keywords,link,title
"Shoes, Leather, Pair, Fashion, Footwear",https://cdn.pixabay.com/photo/2015/06/29/15/33/shoes-825674__340.jpg,"Shoes, Leather, Pair, Fashion"
"Summer Still-Life, Garden, Outdoors",https://cdn.pixabay.com/photo/2015/05/25/14/27/summer-still-life-783347__340.jpg,"Summer Still-Life, Garden, Outdoors"
"People, Homeless, Woman, Street, Poverty",https://cdn.pixabay.com/photo/2015/07/15/06/42/people-845710__340.jpg,"People, Homeless, Woman, Street"
"Doe, Hirsch, Female, Oversleeping",https://cdn.pixabay.com/photo/2014/08/28/23/12/doe-430238__340.jpg,"Doe, Hirsch, Female, Oversleeping"
"Child, Girl, Kambotscha",https://cdn.pixabay.com/photo/2015/02/25/16/26/child-649021__340.jpg,"Child, Girl, Kambotscha"
"Loro Park, Orca, Fish",https://cdn.pixabay.com/photo/2015/07/24/09/38/loro-park-858066__340.jpg,"Loro Park, Orca, Fish"
"Demonstration, Hair, Model, Show, Female",https://cdn.pixabay.com/photo/2014/08/23/15/44/demonstration-425278__340.jpg,"Demonstration, Hair, Model, Show"
"Horse, Herd, Fog, Nature, Wild, Equine",https://cdn.pixabay.com/photo/2014/08/29/03/02/horse-430441__340.jpg,"Horse, Herd, Fog, Nature, Wild"
"Cobweb, Morgentau, Dew, Dewdrop, Drip",https://cdn.pixabay.com/photo/2010/12/28/00/28/cobweb-4191__340.jpg,"Cobweb, Morgentau, Dew, Dewdrop"
"Map, South America, Atlas",https://cdn.pixabay.com/photo/2014/08/26/21/52/map-428639__340.jpg,"Map, South America, Atlas"
"Clouds, The Rays, The Sun",https://cdn.pixabay.com/photo/2014/08/26/16/25/clouds-428168__340.jpg,"Clouds, The Rays, The Sun"
"The Ball, Sport, Game, Football",https://cdn.pixabay.com/photo/2014/08/26/19/19/the-ball-428317__340.jpg,"The Ball, Sport, Game, Football"
"Runner, Marathon, Military, Afghanistan",https://cdn.pixabay.com/photo/2015/06/09/04/48/runner-802912__340.jpg,"Runner, Marathon, Military"
"Paprika, Fruit",https://cdn.pixabay.com/photo/2015/03/13/17/07/paprika-671959__340.jpg,"Paprika, Fruit"
"Photography, Taking, Picture, Display",https://cdn.pixabay.com/photo/2015/06/08/15/09/photography-801891__340.jpg,"Photography, Taking, Picture"
"Pier, Jetty, Wooden, Beach, Sand, Bridge",https://cdn.pixabay.com/photo/2015/06/08/14/53/pier-801761__340.jpg,"Pier, Jetty, Wooden, Beach, Sand"
"People, Peoples, Homeless, Male, Poverty",https://cdn.pixabay.com/photo/2015/07/14/06/06/people-844209__340.jpg,"People, Peoples, Homeless, Male"
"Gentian, Blue, Alpine, Flower",https://cdn.pixabay.com/photo/2014/08/30/11/58/gentian-431575__340.jpg,"Gentian, Blue, Alpine, Flower"
"Hats, Fedora, Hat Manufacture, Stack",https://cdn.pixabay.com/photo/2015/07/02/20/13/hats-829509__340.jpg,"Hats, Fedora, Hat Manufacture"
"Wine, A Glass Of, Red, Red Wine, Glass",https://cdn.pixabay.com/photo/2014/08/26/19/19/wine-428313__340.jpg,"Wine, A Glass Of, Red, Red Wine"
"Light, Car, Reflector, Auto",https://cdn.pixabay.com/photo/2014/08/26/21/21/light-428512__340.jpg,"Light, Car, Reflector, Auto"
"Alcohol, Hangover, Event, Death, Drunk",https://cdn.pixabay.com/photo/2014/08/26/20/08/alcohol-428392__340.jpg,"Alcohol, Hangover, Event, Death"
"Flowers, Tulips, Bouquet, Cut Flowers",https://cdn.pixabay.com/photo/2014/08/27/10/46/flowers-429041__340.jpg,"Flowers, Tulips, Bouquet"
"Penguins, Emperor, Antarctic, Life",https://cdn.pixabay.com/photo/2014/08/27/12/58/penguins-429128__340.jpg,"Penguins, Emperor, Antarctic, Life"
"Roundabout, Movement, Turn, Colorful",https://cdn.pixabay.com/photo/2014/08/27/19/33/roundabout-429453__340.jpg,"Roundabout, Movement, Turn"
"By Wlodek, Old, Close, Hack, Closed",https://cdn.pixabay.com/photo/2014/08/26/21/29/by-wlodek-428549__340.jpg,"By Wlodek, Old, Close, Hack, Closed"
"Girl, Kambotscha, Child",https://cdn.pixabay.com/photo/2015/02/25/16/20/girl-649011__340.jpg,"Girl, Kambotscha, Child"
"Drop Of Water, Beaded, Raindrop, Drip",https://cdn.pixabay.com/photo/2015/07/27/10/40/drop-of-water-862316__340.jpg,"Drop Of Water, Beaded, Raindrop"
"Easter, Hare, Easter Bunny",https://cdn.pixabay.com/photo/2015/02/18/16/40/easter-640989__340.jpg,"Easter, Hare, Easter Bunny"
"People, Peoples, Homeless, Male, Color",https://cdn.pixabay.com/photo/2015/07/14/06/09/people-844211__340.jpg,"People, Peoples, Homeless, Male"
"Dandelion, Nature, Flora, White, Natural",https://cdn.pixabay.com/photo/2014/08/29/13/19/dandelion-431079__340.jpg,"Dandelion, Nature, Flora, White"
"Lake, Water, Brightness, Reflection",https://cdn.pixabay.com/photo/2014/08/29/04/14/lake-430508__340.jpg,"Lake, Water, Brightness, Reflection"
"Leaves, Branches, Canopy, Chestnut Tree",https://cdn.pixabay.com/photo/2014/08/31/19/05/leaves-432325__340.jpg,"Leaves, Branches, Canopy"
"Family, Mom, Daughter, Smiling, Happy",https://cdn.pixabay.com/photo/2015/05/20/09/32/family-775059__340.jpg,"Family, Mom, Daughter, Smiling"
"Pier, Sunset, Water, Ocean, Landscape",https://cdn.pixabay.com/photo/2015/04/22/12/40/pier-734702__340.jpg,"Pier, Sunset, Water, Ocean"
"Penguin, Baby, Antarctic, Life, Animal",https://cdn.pixabay.com/photo/2014/08/27/12/57/penguin-429125__340.jpg,"Penguin, Baby, Antarctic, Life"
"Bible, Scripture, Gospel, Testament",https://cdn.pixabay.com/photo/2014/08/27/07/36/bible-428947__340.jpg,"Bible, Scripture, Gospel, Testament"
"Sea Of Fog, Fog, Ocean, Sea, Pier",https://cdn.pixabay.com/photo/2014/06/21/14/26/sea-of-fog-373782__340.jpg,"Sea Of Fog, Fog, Ocean, Sea, Pier"
"Soap Bubble, Colorful, Ball, Soapy Water",https://cdn.pixabay.com/photo/2015/06/28/14/10/soap-bubble-824558__340.jpg,"Soap Bubble, Colorful, Ball"
"Teenager, Daughter, Happy, Smiling",https://cdn.pixabay.com/photo/2015/05/20/09/22/teenager-775053__340.jpg,"Teenager, Daughter, Happy, Smiling"
"Sunset, Sky, Sun, Evening, Glow, Orange",https://cdn.pixabay.com/photo/2014/08/30/23/37/sunset-431894__340.jpg,"Sunset, Sky, Sun, Evening, Glow"
"Medications, Cure, Tablets, Pharmacy",https://cdn.pixabay.com/photo/2014/02/03/11/51/medications-257349__340.jpg,"Medications, Cure, Tablets"
"Chess, Game, Chessboard, Glass, Board",https://cdn.pixabay.com/photo/2014/09/01/19/39/chess-433071__340.jpg,"Chess, Game, Chessboard, Glass"
"Frond, Palm, Leaf, Bangalow Palm, Green",https://cdn.pixabay.com/photo/2014/09/01/12/51/frond-432801__340.jpg,"Frond, Palm, Leaf, Bangalow Palm"
"Child, Childrens, Baby, Children'S",https://cdn.pixabay.com/photo/2015/06/22/08/38/child-817368__340.jpg,"Child, Childrens, Baby, Children'S"
"Landscape, Rocks, Ocean, Nature",https://cdn.pixabay.com/photo/2015/06/25/17/23/landscape-821573__340.jpg,"Landscape, Rocks, Ocean, Nature"
"Morning, Coffee, Cup, Drink, Table",https://cdn.pixabay.com/photo/2015/06/24/01/15/morning-819362__340.jpg,"Morning, Coffee, Cup, Drink, Table"
"Sports, Surf, People, Beach, Sand, Sea",https://cdn.pixabay.com/photo/2014/08/26/15/09/sports-428030__340.jpg,"Sports, Surf, People, Beach, Sand"
"Dentist, Equipment, Replacement Lamp",https://cdn.pixabay.com/photo/2014/08/26/21/56/dentist-428650__340.jpg,"Dentist, Equipment"
"Apple Tree, Branch, Apple, Fruit, Sweet",https://cdn.pixabay.com/photo/2014/08/27/14/42/apple-tree-429213__340.jpg,"Apple Tree, Branch, Apple, Fruit"
"Rotary Valves, Tuba, Valves, Stimmzug",https://cdn.pixabay.com/photo/2014/08/28/16/58/rotary-valves-429948__340.jpg,"Rotary Valves, Tuba, Valves"
"Dogs, Heads, Makes Posturing, Ernst",https://cdn.pixabay.com/photo/2014/08/28/22/40/dogs-430192__340.jpg,"Dogs, Heads, Makes Posturing, Ernst"
"Greece, Sunset, Crete, Summer",https://cdn.pixabay.com/photo/2014/08/28/23/40/greece-430327__340.jpg,"Greece, Sunset, Crete, Summer"
"Boy, Player, Baseball, Pitcher, Sport",https://cdn.pixabay.com/photo/2014/09/01/10/31/boy-432680__340.jpg,"Boy, Player, Baseball, Pitcher"
"Bee, Blossom, Bloom, Close, Insect",https://cdn.pixabay.com/photo/2014/09/01/19/30/bee-433062__340.jpg,"Bee, Blossom, Bloom, Close, Insect"
"Shoes, Leather, Single, Fashion",https://cdn.pixabay.com/photo/2015/06/29/15/32/shoes-825672__340.jpg,"Shoes, Leather, Single, Fashion"
"Self, Old-Car, Motor, Vintage, White",https://cdn.pixabay.com/photo/2015/06/20/13/55/self-815795__340.jpg,"Self, Old-Car, Motor, Vintage"
"Camera, Retro, Ricoh, Old Camera",https://cdn.pixabay.com/photo/2015/06/18/15/20/camera-813814__340.jpg,"Camera, Retro, Ricoh, Old Camera"
"Oboe, Music, Tool, Art",https://cdn.pixabay.com/photo/2014/09/01/20/22/oboe-433122__340.jpg,"Oboe, Music, Tool, Art"
"Breakfast, Fried Eggs, Meal, Egg, Food",https://cdn.pixabay.com/photo/2015/07/17/00/52/breakfast-848313__340.jpg,"Breakfast, Fried Eggs, Meal, Egg"
"Money, Card, Business, Pocket, Shopping",https://cdn.pixabay.com/photo/2014/02/01/17/50/money-256282__340.jpg,"Money, Card, Business, Pocket"
"Apple, Education, School, Knowledge",https://cdn.pixabay.com/photo/2014/02/01/17/28/apple-256262__340.jpg,"Apple, Education, School, Knowledge"
"Racing, F1, Gokart, Rally, Car, Auto",https://cdn.pixabay.com/photo/2014/01/29/20/58/racing-254609__340.jpg,"Racing, F1, Gokart, Rally, Car"
"Cat, Video, Photo, Photographer, Photos",https://cdn.pixabay.com/photo/2014/01/29/20/23/cat-254572__340.jpg,"Cat, Video, Photo, Photographer"
"Burger, Cheese, Food, Hamburger, Fast",https://cdn.pixabay.com/photo/2015/07/01/07/06/burger-827309__340.jpg,"Burger, Cheese, Food, Hamburger"
"Water Plant, Green, Fine, Layers",https://cdn.pixabay.com/photo/2015/06/25/14/13/water-plant-821293__340.jpg,"Water Plant, Green, Fine, Layers"
"Homeless, Youth, Male, Sad, Young",https://cdn.pixabay.com/photo/2015/07/18/07/16/homeless-850086__340.jpg,"Homeless, Youth, Male, Sad, Young"
"Person, Human, Child, Girl, Face, Wet",https://cdn.pixabay.com/photo/2015/06/17/17/35/person-812796__340.jpg,"Person, Human, Child, Girl, Face"
"Woman, Dandelions, Girl, Lying, Summer",https://cdn.pixabay.com/photo/2015/01/23/17/33/woman-609254__340.jpg,"Woman, Dandelions, Girl, Lying"
"Pregnancy, Pregnant, Mom, Dad",https://cdn.pixabay.com/photo/2015/05/20/09/20/pregnancy-775041__340.jpg,"Pregnancy, Pregnant, Mom, Dad"
"Vegetables, Garden, Harvest, Organic",https://cdn.pixabay.com/photo/2015/05/30/01/18/vegetables-790022__340.jpg,"Vegetables, Garden, Harvest"
"Cosmos Flower, Cosmos, Flower, Bloom",https://cdn.pixabay.com/photo/2014/09/02/06/02/cosmos-flower-433424__340.jpg,"Cosmos Flower, Cosmos, Flower"
"Bomber, Vulcan, Aircraft, Aeroplane, Raf",https://cdn.pixabay.com/photo/2014/08/28/18/01/bomber-429993__340.jpg,"Bomber, Vulcan, Aircraft, Aeroplane"
"Eraser, Office Supplies, Office",https://cdn.pixabay.com/photo/2015/06/02/23/34/eraser-795768__340.jpg,"Eraser, Office Supplies, Office"
"Wheel, Alloy, Car",https://cdn.pixabay.com/photo/2015/06/24/14/04/wheel-820099__340.jpg,"Wheel, Alloy, Car"
"Soap Bubble, Colorful, Ball, Soapy Water",https://cdn.pixabay.com/photo/2015/06/28/14/14/soap-bubble-824584__340.jpg,"Soap Bubble, Colorful, Ball"
"Books, Education, School, Literature",https://cdn.pixabay.com/photo/2014/09/11/18/32/books-441866__340.jpg,"Books, Education, School"
"Old Letters, Old, Letter, Handwriting",https://cdn.pixabay.com/photo/2014/09/05/18/33/old-letters-436501__340.jpg,"Old Letters, Old, Letter"
"Pumpkin, Gourd, Decoration, Structure",https://cdn.pixabay.com/photo/2014/09/10/22/35/pumpkin-441203__340.jpg,"Pumpkin, Gourd, Decoration"
"Alligator, American Alligator, Gator",https://cdn.pixabay.com/photo/2014/09/09/02/46/alligator-439887__340.jpg,"Alligator, American Alligator"
"Cd, Dvd, Disk, Floppy Disk, Computer",https://cdn.pixabay.com/photo/2014/09/07/11/13/cd-437723__340.jpg,"Cd, Dvd, Disk, Floppy Disk"
"Man, Boy, Colorful, Painted, Male, Funny",https://cdn.pixabay.com/photo/2014/09/07/17/42/man-438140__340.jpg,"Man, Boy, Colorful, Painted, Male"
"Old Books, Book, Old, Library, Education",https://cdn.pixabay.com/photo/2014/09/05/18/32/old-books-436498__340.jpg,"Old Books, Book, Old, Library"
"Water Fight, Children, Water, Play",https://cdn.pixabay.com/photo/2014/09/12/02/14/water-fight-442257__340.jpg,"Water Fight, Children, Water, Play"
"Dragonfly, Insect, Green, Closeup, Blue",https://cdn.pixabay.com/photo/2014/09/11/11/22/dragonfly-441624__340.jpg,"Dragonfly, Insect, Green, Closeup"
"Corn Field, Blue Sky, Countryside",https://cdn.pixabay.com/photo/2014/09/09/19/07/corn-field-440338__340.jpg,"Corn Field, Blue Sky, Countryside"
"Hands, Love, Couple, Together, Fingers",https://cdn.pixabay.com/photo/2014/09/07/16/53/hands-437968__340.jpg,"Hands, Love, Couple, Together"
"Gummibärchen, Color, Candy, Nibble",https://cdn.pixabay.com/photo/2014/09/12/10/10/gummibarchen-442543__340.jpg,"Gummibärchen, Color, Candy, Nibble"
"Butterfly, Insect, Colorful, Moth",https://cdn.pixabay.com/photo/2015/06/19/08/57/butterfly-814568__340.jpg,"Butterfly, Insect, Colorful, Moth"
"Water Lilies, Purple, Aquatic Plant",https://cdn.pixabay.com/photo/2014/09/10/08/53/water-lilies-440622__340.jpg,"Water Lilies, Purple, Aquatic Plant"
"Moth, Large, Insect, Yellow, Black, Blue",https://cdn.pixabay.com/photo/2014/08/23/11/32/moth-425162__340.jpg,"Moth, Large, Insect, Yellow, Black"
"People, Peoples, Homeless, Male, Street",https://cdn.pixabay.com/photo/2015/07/14/06/04/people-844207__340.jpg,"People, Peoples, Homeless, Male"
"Portrait, Advertisement, Black And White",https://cdn.pixabay.com/photo/2015/06/19/09/40/portrait-814633__340.jpg,"Portrait, Advertisement"
"Muscari, Common Grape Hyacinth, Blossom",https://cdn.pixabay.com/photo/2013/05/30/02/20/muscari-114579__340.jpg,"Muscari, Common Grape Hyacinth"
"Strawberries, Strawberry Jam",https://cdn.pixabay.com/photo/2015/06/19/16/00/strawberries-815057__340.jpg,"Strawberries, Strawberry Jam"
"Sphynx, Cat, Race Cat, Bald, Hairless",https://cdn.pixabay.com/photo/2015/06/18/21/53/sphynx-814164__340.jpg,"Sphynx, Cat, Race Cat, Bald"
"The Nutcracker, Old, Zeromski, Kielce",https://cdn.pixabay.com/photo/2014/09/05/18/32/the-nutcracker-436493__340.jpg,"The Nutcracker, Old, Zeromski"
"Fern, American Hart'S-Tongue Fern, Green",https://cdn.pixabay.com/photo/2014/09/08/21/42/fern-439595__340.jpg,"Fern, American Hart'S-Tongue Fern"
"Mountain Climbing, Mountain Climber",https://cdn.pixabay.com/photo/2015/06/08/15/29/mountain-climbing-802099__340.jpg,"Mountain Climbing, Mountain Climber"
"People, Homeless, Woman, Street, Poverty",https://cdn.pixabay.com/photo/2015/07/18/23/09/people-850949__340.jpg,"People, Homeless, Woman, Street"
"Desert, Slate, Pudding, Dining, Food",https://cdn.pixabay.com/photo/2015/06/18/17/36/desert-813924__340.jpg,"Desert, Slate, Pudding, Dining"
"Girl, Fairy, Happy, Pink, Birthday, Kid",https://cdn.pixabay.com/photo/2015/06/17/14/01/girl-812482__340.jpg,"Girl, Fairy, Happy, Pink, Birthday"
"Dog, Brown, Snout, Fur, Hybrid, Animal",https://cdn.pixabay.com/photo/2015/06/17/21/47/dog-813103__340.jpg,"Dog, Brown, Snout, Fur, Hybrid"
"Guitar, Bass, Instrument, Black",https://cdn.pixabay.com/photo/2015/06/16/16/48/guitar-811343__340.jpg,"Guitar, Bass, Instrument, Black"
"Roses, Red Roses, Bouquet Of Roses",https://cdn.pixabay.com/photo/2015/06/25/19/08/roses-821705__340.jpg,"Roses, Red Roses, Bouquet Of Roses"
"Airshow, Fighter Jets, Aerobatic",https://cdn.pixabay.com/photo/2014/09/10/00/30/airshow-440510__340.jpg,"Airshow, Fighter Jets, Aerobatic"
"People, Homeless, Male, Street, Poverty",https://cdn.pixabay.com/photo/2015/07/18/23/06/people-850948__340.jpg,"People, Homeless, Male, Street"
"Fern, Brake, Plant, Green, Forest, Leaf",https://cdn.pixabay.com/photo/2015/07/02/10/43/fern-828933__340.jpg,"Fern, Brake, Plant, Green, Forest"
"Guinea-Pig, Female, Agouti, Portrait",https://cdn.pixabay.com/photo/2014/09/17/21/13/guinea-pig-449983__340.jpg,"Guinea-Pig, Female, Agouti"
"Man, Strange, Male, Funny, Face, Person",https://cdn.pixabay.com/photo/2015/06/02/01/19/man-794514__340.jpg,"Man, Strange, Male, Funny, Face"
"Keyboard Instrument, Music, Old, Antique",https://cdn.pixabay.com/photo/2014/09/05/18/31/keyboard-instrument-436488__340.jpg,"Keyboard Instrument, Music, Old"
"Cube, Play, Colorful, Eye Numbers, Six",https://cdn.pixabay.com/photo/2014/09/12/10/10/cube-442544__340.jpg,"Cube, Play, Colorful, Eye Numbers"
"Seabird, Bird, Nature, Animal, Seagull",https://cdn.pixabay.com/photo/2015/05/15/14/36/seabird-768584__340.jpg,"Seabird, Bird, Nature, Animal"
"Tomato, Red, Salad, Food, Fresh",https://cdn.pixabay.com/photo/2015/05/16/15/03/tomato-769999__340.jpg,"Tomato, Red, Salad, Food, Fresh"
"Technology, Digital, Tablet",https://cdn.pixabay.com/photo/2015/05/31/15/18/technology-792180__340.jpg,"Technology, Digital, Tablet"
"Gun, Shoot, Cartridge, War, Weapons",https://cdn.pixabay.com/photo/2014/09/17/18/32/gun-449783__340.jpg,"Gun, Shoot, Cartridge, War, Weapons"
"Pasta, Cheese, Egg, Food, Italian",https://cdn.pixabay.com/photo/2015/06/01/23/43/pasta-794464__340.jpg,"Pasta, Cheese, Egg, Food, Italian"
"Sofa, Couch, Cat, British Shorthair",https://cdn.pixabay.com/photo/2015/05/28/20/43/sofa-788537__340.jpg,"Sofa, Couch, Cat, British Shorthair"
"Strawberries, Berries, Fruit, Close, Eat",https://cdn.pixabay.com/photo/2015/06/27/19/58/strawberries-823782__340.jpg,"Strawberries, Berries, Fruit, Close"
"Man, Board Game, Old, Elderly, Portrait",https://cdn.pixabay.com/photo/2015/06/06/00/49/man-798989__340.jpg,"Man, Board Game, Old, Elderly"
"Window, Hauswand, House Facade",https://cdn.pixabay.com/photo/2015/07/04/12/09/window-831251__340.jpg,"Window, Hauswand, House Facade"
"Fruits, Garden, Fruit, Harvest",https://cdn.pixabay.com/photo/2015/07/18/15/31/fruits-850491__340.jpg,"Fruits, Garden, Fruit, Harvest"
"Leaves, Autumn, Red, Tree",https://cdn.pixabay.com/photo/2014/09/17/15/33/leaves-449622__340.jpg,"Leaves, Autumn, Red, Tree"
"Wall, Stones, Hauswand, Structure",https://cdn.pixabay.com/photo/2014/09/17/21/43/wall-450106__340.jpg,"Wall, Stones, Hauswand, Structure"
"Mackerel Sky, Moonlit Night, Cloud",https://cdn.pixabay.com/photo/2014/09/17/13/42/mackerel-sky-449475__340.jpg,"Mackerel Sky, Moonlit Night, Cloud"
"Ladybird, Flower, Nature, Ladybug",https://cdn.pixabay.com/photo/2014/09/17/11/02/ladybird-449333__340.jpg,"Ladybird, Flower, Nature, Ladybug"
"Money, Card, Business, Pocket, Visa",https://cdn.pixabay.com/photo/2014/02/01/17/50/money-256281__340.jpg,"Money, Card, Business, Pocket, Visa"
"Apple, Education, School, Knowledge",https://cdn.pixabay.com/photo/2014/02/01/17/30/apple-256268__340.jpg,"Apple, Education, School, Knowledge"
"Paris, France, French, Eiffel Tower",https://cdn.pixabay.com/photo/2015/07/13/14/40/paris-843229__340.jpg,"Paris, France, French, Eiffel Tower"
"Ballet, Dancer, Male, Performance",https://cdn.pixabay.com/photo/2015/07/08/10/21/ballet-835757__340.jpg,"Ballet, Dancer, Male, Performance"
"Sand Castle, Beach, Holidays, Water, Sea",https://cdn.pixabay.com/photo/2015/06/03/14/36/sand-castle-796488__340.jpg,"Sand Castle, Beach, Holidays, Water"
"Cooking, Baby, Only, Kitchen, Chef",https://cdn.pixabay.com/photo/2015/05/20/14/23/cooking-775503__340.jpg,"Cooking, Baby, Only, Kitchen, Chef"
"Grapes, Green, Fruit, Food, Winegrowing",https://cdn.pixabay.com/photo/2014/09/17/16/36/grapes-449678__340.jpg,"Grapes, Green, Fruit, Food"
"Mushroom, Nature, White, Raindrop",https://cdn.pixabay.com/photo/2014/06/19/06/27/mushroom-372044__340.jpg,"Mushroom, Nature, White, Raindrop"
"Bird Feather, Hawk Feather, Feather",https://cdn.pixabay.com/photo/2014/09/17/20/17/bird-feather-449940__340.jpg,"Bird Feather, Hawk Feather, Feather"
"Young Animal, Monkey, Barbary Ape",https://cdn.pixabay.com/photo/2014/09/17/21/56/young-animal-450149__340.jpg,"Young Animal, Monkey, Barbary Ape"
"Gathering, Mushroom, Rac, Boletus Badius",https://cdn.pixabay.com/photo/2014/09/16/22/12/gathering-448866__340.jpg,"Gathering, Mushroom, Rac"
"Leopard, Animal, Cat, Cheetah, Amur, Zoo",https://cdn.pixabay.com/photo/2014/09/16/22/42/leopard-448901__340.jpg,"Leopard, Animal, Cat, Cheetah, Amur"
"Boot, Cowgirl, Horse, Tack, Saddle",https://cdn.pixabay.com/photo/2014/09/17/01/14/boot-449044__340.jpg,"Boot, Cowgirl, Horse, Tack, Saddle"
"Ważka, Insect, Compound Eyes, Macro",https://cdn.pixabay.com/photo/2015/05/27/22/04/wazka-787258__340.jpg,"Ważka, Insect, Compound Eyes, Macro"
"Urban, People, Crowd, Citizens, Persons",https://cdn.pixabay.com/photo/2014/09/07/21/52/urban-438393__340.jpg,"Urban, People, Crowd, Citizens"
"Beautiful, Young, Girl, Women, Lay",https://cdn.pixabay.com/photo/2012/12/21/10/06/beautiful-71493__340.jpg,"Beautiful, Young, Girl, Women, Lay"
"Hyla Meridionalis, The Frog, Amphibians",https://cdn.pixabay.com/photo/2015/06/03/14/16/hyla-meridionalis-796466__340.jpg,"Hyla Meridionalis, The Frog"
"Drip, Water, Two, Pair, Leaf",https://cdn.pixabay.com/photo/2013/05/12/11/03/drip-110785__340.jpg,"Drip, Water, Two, Pair, Leaf"
"Bird, Bullfinch, Males, Garden, Branch",https://cdn.pixabay.com/photo/2015/05/07/21/30/bird-757222__340.jpg,"Bird, Bullfinch, Males, Garden"
"Ladybug, Insect, Nature",https://cdn.pixabay.com/photo/2015/06/03/14/27/ladybug-796483__340.jpg,"Ladybug, Insect, Nature"
"Candlestick, Candles, Decoration",https://cdn.pixabay.com/photo/2014/09/16/20/09/candlestick-448683__340.jpg,"Candlestick, Candles, Decoration"
"Potatoes, Vegetables, Field, Eat, Bio",https://cdn.pixabay.com/photo/2014/09/16/18/27/potatoes-448610__340.jpg,"Potatoes, Vegetables, Field, Eat"
"Peppers, Bell Pepper, Food, Healthy",https://cdn.pixabay.com/photo/2014/09/14/18/43/peppers-445274__340.jpg,"Peppers, Bell Pepper, Food, Healthy"
"Letter, Handwriting, Family Letters",https://cdn.pixabay.com/photo/2014/09/15/22/23/letter-447577__340.jpg,"Letter, Handwriting, Family Letters"
"Bird, Blackbird, Nest, Hatching, Boy",https://cdn.pixabay.com/photo/2015/06/01/18/57/bird-793914__340.jpg,"Bird, Blackbird, Nest, Hatching"
"Shoes, Leather, Pair, Fashion, Footwear",https://cdn.pixabay.com/photo/2015/06/29/15/32/shoes-825671__340.jpg,"Shoes, Leather, Pair, Fashion"
"Blueberries, Raspberries In Bowl, Summer",https://cdn.pixabay.com/photo/2015/05/25/14/30/blueberries-783354__340.jpg,"Blueberries, Raspberries In Bowl"
"Rose, Pink, Petals, Flower, Rose Bloom",https://cdn.pixabay.com/photo/2015/06/01/16/43/rose-793759__340.jpg,"Rose, Pink, Petals, Flower"
"Hall, Conference, Effect Picture",https://cdn.pixabay.com/photo/2015/07/02/09/53/hall-828549__340.jpg,"Hall, Conference, Effect Picture"
"Instruments, Music, Drums, Guitar",https://cdn.pixabay.com/photo/2015/06/08/08/30/instruments-801271__340.jpg,"Instruments, Music, Drums, Guitar"
"Skytrain, Thailand, Transportation, Sky",https://cdn.pixabay.com/photo/2014/09/23/08/05/skytrain-457296__340.jpg,"Skytrain, Thailand, Transportation"
"Photography, Camera Lens, Lens, Closeup",https://cdn.pixabay.com/photo/2014/09/23/20/13/photography-458050__340.jpg,"Photography, Camera Lens, Lens"
"Drill, Milling, Milling Machine",https://cdn.pixabay.com/photo/2014/09/13/21/48/drill-444510__340.jpg,"Drill, Milling, Milling Machine"
"Brothers, Family, Siblings, Boys, Love",https://cdn.pixabay.com/photo/2014/09/23/06/04/brothers-457237__340.jpg,"Brothers, Family, Siblings, Boys"
"Buddhists, Monks, Orange, Robes",https://cdn.pixabay.com/photo/2014/09/22/13/12/buddhists-456282__340.jpg,"Buddhists, Monks, Orange, Robes"
"Cup Of Coffee, Coffee Break, Coffee, Cup",https://cdn.pixabay.com/photo/2014/09/21/19/26/cup-of-coffee-455423__340.jpg,"Cup Of Coffee, Coffee Break, Coffee"
"Beach, Girls, Relax, Sunshine, Holidays",https://cdn.pixabay.com/photo/2014/09/22/00/56/beach-455752__340.jpg,"Beach, Girls, Relax, Sunshine"
"Rain, After The Rain, A Drop Of",https://cdn.pixabay.com/photo/2014/09/21/14/35/rain-455120__340.jpg,"Rain, After The Rain, A Drop Of"
"Still Life, Food, Dinner, Table",https://cdn.pixabay.com/photo/2014/06/29/22/58/still-life-379858__340.jpg,"Still Life, Food, Dinner, Table"
"Messerschmitt Kr200, Classic Car",https://cdn.pixabay.com/photo/2014/09/02/12/06/messerschmitt-kr200-433577__340.jpg,"Messerschmitt Kr200, Classic Car"
"Sheep, Moss, Meadow, Eyes, Wood",https://cdn.pixabay.com/photo/2014/09/20/13/56/sheep-453812__340.jpg,"Sheep, Moss, Meadow, Eyes, Wood"
"Naked, Women, Female, Model, Sexy",https://cdn.pixabay.com/photo/2014/09/20/01/15/naked-453253__340.jpg,"Naked, Women, Female, Model, Sexy"
"Styggkärret, Reserve, Burning, Fire",https://cdn.pixabay.com/photo/2014/09/02/15/28/styggkarret-433688__340.jpg,"Styggkärret, Reserve, Burning, Fire"
"Eastern Water Dragon, Lizard, Reptile",https://cdn.pixabay.com/photo/2014/09/15/12/18/eastern-water-dragon-446871__340.jpg,"Eastern Water Dragon, Lizard"
"Peacock, Four Spot, Feather, Bird",https://cdn.pixabay.com/photo/2014/09/20/14/33/peacock-453846__340.jpg,"Peacock, Four Spot, Feather, Bird"
"Forest, Path, Mystical, Rocks, Fairytale",https://cdn.pixabay.com/photo/2014/09/07/22/17/forest-438432__340.jpg,"Forest, Path, Mystical, Rocks"
"Car Race, Ferrari, Racing Car, Pirelli",https://cdn.pixabay.com/photo/2014/09/07/22/34/car-race-438467__340.jpg,"Car Race, Ferrari, Racing Car"
"Dream, Surreal, Composition, Elephant",https://cdn.pixabay.com/photo/2014/04/28/12/29/dream-333815__340.jpg,"Dream, Surreal, Composition"
"Glass Trophies, Blown, Stemmed Glasses",https://cdn.pixabay.com/photo/2014/09/20/15/51/glass-trophies-453954__340.jpg,"Glass Trophies, Blown"
"Cocoa, Man, Colombia, Peasant, Hand",https://cdn.pixabay.com/photo/2014/09/19/19/13/cocoa-452911__340.jpg,"Cocoa, Man, Colombia, Peasant, Hand"
"Robin, Bird, On Branch, In The Garden",https://cdn.pixabay.com/photo/2015/06/22/22/41/robin-818126__340.jpg,"Robin, Bird, On Branch"
"Armadillo, Worm, Bug, Insect",https://cdn.pixabay.com/photo/2015/05/30/13/58/armadillo-790350__340.jpg,"Armadillo, Worm, Bug, Insect"
"Ladybug, Insect, Nature",https://cdn.pixabay.com/photo/2015/06/03/14/24/ladybug-796481__340.jpg,"Ladybug, Insect, Nature"
"Eating, Breakfast, Food, Dish",https://cdn.pixabay.com/photo/2015/06/03/14/40/eating-796490__340.jpg,"Eating, Breakfast, Food, Dish"
"Rose, Red Rose, Romantic, Rose Bloom",https://cdn.pixabay.com/photo/2015/06/17/17/20/rose-812765__340.jpg,"Rose, Red Rose, Romantic"
