keywords,link,title
"Nature, Dandelion, Macro, Close, Flower",https://cdn.pixabay.com/photo/2018/01/19/14/40/nature-3092555__340.jpg,"Nature, Dandelion, Macro, Close"
"Time, Clock, Background, Wrist Watch",https://cdn.pixabay.com/photo/2018/01/18/19/06/time-3091031__340.jpg,"Time, Clock, Background"
"Man, Red Hair, Beard, Red Beard, Redhead",https://cdn.pixabay.com/photo/2016/11/16/10/28/man-1828542__340.jpg,"Man, Red Hair, Beard, Red Beard"
"Rail, Girl, Composing, Fantasy",https://cdn.pixabay.com/photo/2017/09/30/22/16/rail-2803725__340.jpg,"Rail, Girl, Composing, Fantasy"
"Owl, Bird, Predator, Branch, Nature",https://cdn.pixabay.com/photo/2016/11/18/12/14/owl-1834152__340.jpg,"Owl, Bird, Predator, Branch, Nature"
"Boys, Outdoor, Thailand, Baby",https://cdn.pixabay.com/photo/2016/11/08/05/31/boy-1807545__340.jpg,"Boys, Outdoor, Thailand, Baby"
"Sea, Ocean, Water, Waves, Nature, Sunset",https://cdn.pixabay.com/photo/2017/07/31/21/45/sea-2561397__340.jpg,"Sea, Ocean, Water, Waves, Nature"
"Asia, Burma, Faith, Boy, Buddha",https://cdn.pixabay.com/photo/2016/11/08/05/17/alms-1807519__340.jpg,"Asia, Burma, Faith, Boy, Buddha"
"Girl, Figure, Cap, Winter, Snow, Cold",https://cdn.pixabay.com/photo/2016/11/13/00/40/girl-1820122__340.jpg,"Girl, Figure, Cap, Winter, Snow"
"Busan Night Scene, Gwangan Bridge, Night",https://cdn.pixabay.com/photo/2016/10/17/07/53/busan-night-scene-1747130__340.jpg,"Busan Night Scene, Gwangan Bridge"
"Sunset, Sky, Waters, Panorama, Evening",https://cdn.pixabay.com/photo/2018/01/16/23/37/sunset-3087145__340.jpg,"Sunset, Sky, Waters, Panorama"
"Nature, Waters, Travel, Mountain",https://cdn.pixabay.com/photo/2018/01/14/23/12/nature-3082832__340.jpg,"Nature, Waters, Travel, Mountain"
"Peacock, Beautiful, Colorful, Bird, Male",https://cdn.pixabay.com/photo/2018/01/13/22/14/peacock-3080897__340.jpg,"Peacock, Beautiful, Colorful, Bird"
"Fashion, Woman, Portrait, Model",https://cdn.pixabay.com/photo/2018/01/13/19/39/fashion-3080644__340.jpg,"Fashion, Woman, Portrait, Model"
"Architecture, Illuminated, Dusk, Travel",https://cdn.pixabay.com/photo/2018/01/11/19/02/architecture-3076685__340.jpg,"Architecture, Illuminated, Dusk"
"Fantasy, Nature, Beautiful, Dawn, Sunset",https://cdn.pixabay.com/photo/2018/01/12/10/19/fantasy-3077928__340.jpg,"Fantasy, Nature, Beautiful, Dawn"
"Woman, Blue Eyes, Blue, Girl",https://cdn.pixabay.com/photo/2016/10/26/16/38/woman-1771895__340.jpg,"Woman, Blue Eyes, Blue, Girl"
"Freezing Earth, Before Sunrise",https://cdn.pixabay.com/photo/2017/06/06/06/03/freezing-earth-2376303__340.jpg,"Freezing Earth, Before Sunrise"
"Lions, Cubs, Pair, Cute, Jungle, Nature",https://cdn.pixabay.com/photo/2017/09/01/01/39/lions-2702828__340.jpg,"Lions, Cubs, Pair, Cute, Jungle"
"Japan, Landscape, Spring, Plant, Flowers",https://cdn.pixabay.com/photo/2017/04/10/15/07/japan-2218788__340.jpg,"Japan, Landscape, Spring, Plant"
"Tulips, Tulip, Orange, Red, Background",https://cdn.pixabay.com/photo/2010/12/13/10/13/tulips-2544__340.jpg,"Tulips, Tulip, Orange, Red"
"Barley Field, Barley, Cereals, Grain",https://cdn.pixabay.com/photo/2011/06/29/16/08/barley-field-8230__340.jpg,"Barley Field, Barley, Cereals"
Golden Mantled Ground Squirrel,https://cdn.pixabay.com/photo/2011/01/17/17/38/golden-mantled-ground-squirrel-4588__340.jpg,Golden Mantled Ground Squirrel
"Oats, Oat Field, Arable, Cereals, Grain",https://cdn.pixabay.com/photo/2011/08/18/02/23/oats-8946__340.jpg,"Oats, Oat Field, Arable, Cereals"
"Abstract, Aqua, Background, Blue, Liquid",https://cdn.pixabay.com/photo/2010/12/13/10/09/abstract-2384__340.jpg,"Abstract, Aqua, Background, Blue"
"Water Lily, Blossom, Bloom, Purple",https://cdn.pixabay.com/photo/2011/01/07/23/05/water-lily-4462__340.jpg,"Water Lily, Blossom, Bloom, Purple"
"Leaf, Droplet, Water, Dew, Drops, Nature",https://cdn.pixabay.com/photo/2011/08/16/14/04/leaf-8701__340.jpg,"Leaf, Droplet, Water, Dew, Drops"
"Animal, Wasp, Insect, Nature, Macro",https://cdn.pixabay.com/photo/2012/03/17/22/03/animal-22872__340.jpg,"Animal, Wasp, Insect, Nature, Macro"
"Drop Of Water, Drip, Close, Grass, Green",https://cdn.pixabay.com/photo/2011/05/31/20/48/drop-of-water-7720__340.jpg,"Drop Of Water, Drip, Close, Grass"
"Daisy, Pollen, Flower, Nature, Flora",https://cdn.pixabay.com/photo/2010/12/16/01/15/daisy-3416__340.jpg,"Daisy, Pollen, Flower, Nature"
"Bloom, Colorful, Coneflower, Detail",https://cdn.pixabay.com/photo/2012/03/17/16/24/bloom-22786__340.jpg,"Bloom, Colorful, Coneflower, Detail"
"Ivy, Plants, Leaves, Wall, Green",https://cdn.pixabay.com/photo/2012/03/07/05/48/ivy-22449__340.jpg,"Ivy, Plants, Leaves, Wall, Green"
"Papilio, Rumanzovia, Butterfly, Animal",https://cdn.pixabay.com/photo/2012/03/06/17/37/papilio-22398__340.jpg,"Papilio, Rumanzovia, Butterfly"
"Flower, Yellow, Sunlight, Sky, Clouds",https://cdn.pixabay.com/photo/2012/03/04/08/28/flower-22260__340.jpg,"Flower, Yellow, Sunlight, Sky"
"Earth, Blue Planet, Globe, Planet, World",https://cdn.pixabay.com/photo/2011/12/13/14/31/earth-11015__340.jpg,"Earth, Blue Planet, Globe, Planet"
"Boot, Water, Sunset, Red, Orange",https://cdn.pixabay.com/photo/2011/10/24/21/36/boot-10216__340.jpg,"Boot, Water, Sunset, Red, Orange"
Golden Mantled Ground Squirrel,https://cdn.pixabay.com/photo/2011/01/17/17/38/golden-mantled-ground-squirrel-4587__340.jpg,Golden Mantled Ground Squirrel
"Pamukkale, Lime Sinter Terrace, Calcium",https://cdn.pixabay.com/photo/2012/02/19/16/17/pamukkale-14983__340.jpg,"Pamukkale, Lime Sinter Terrace"
"Glasses, Restaurant, Glass, Drink",https://cdn.pixabay.com/photo/2012/01/31/13/41/glasses-11937__340.jpg,"Glasses, Restaurant, Glass, Drink"
"Tulips, Holland, Tulip Fields",https://cdn.pixabay.com/photo/2011/11/11/00/53/tulips-10296__340.jpg,"Tulips, Holland, Tulip Fields"
"Beautiful, Close-Up, Eye, Eyebrows",https://cdn.pixabay.com/photo/2010/12/13/10/07/beautiful-2315__340.jpg,"Beautiful, Close-Up, Eye, Eyebrows"
"Leaves, Twig, Branch, Sky, Blue, Cloud",https://cdn.pixabay.com/photo/2012/02/23/08/43/leaves-15757__340.jpg,"Leaves, Twig, Branch, Sky, Blue"
"Abstract, Architecture, Background",https://cdn.pixabay.com/photo/2012/03/04/00/21/abstract-21883__340.jpg,"Abstract, Architecture, Background"
"Hornet, Wasp, Insect, Sting, Macro",https://cdn.pixabay.com/photo/2012/01/06/02/17/hornet-11514__340.jpg,"Hornet, Wasp, Insect, Sting, Macro"
"Wheat, Wheat Field, Wheat Spike, Spike",https://cdn.pixabay.com/photo/2011/06/29/16/25/wheat-8244__340.jpg,"Wheat, Wheat Field, Wheat Spike"
"Astronaut, Space Shuttle, Space Walk",https://cdn.pixabay.com/photo/2011/12/13/17/09/astronaut-11050__340.jpg,"Astronaut, Space Shuttle"
"Snow, Trees, Winter, Water, Season, Ice",https://cdn.pixabay.com/photo/2012/03/04/00/36/snow-21979__340.jpg,"Snow, Trees, Winter, Water, Season"
"Acoustic Guitar, Cute, Female, Girl",https://cdn.pixabay.com/photo/2012/02/22/20/09/acoustic-guitar-15598__340.jpg,"Acoustic Guitar, Cute, Female, Girl"
"Flowers, Summer, Orange, Yellow, Nature",https://cdn.pixabay.com/photo/2012/03/19/02/31/flowers-22893__340.jpg,"Flowers, Summer, Orange, Yellow"
"Animal, Ape, Chimp, Chimpanzee, Cute",https://cdn.pixabay.com/photo/2010/12/13/10/17/animal-2602__340.jpg,"Animal, Ape, Chimp, Chimpanzee"
"Adorable, Baby, Basket, Beautiful, Boy",https://cdn.pixabay.com/photo/2012/03/02/12/43/adorable-21259__340.jpg,"Adorable, Baby, Basket, Beautiful"
"Swan, Bird, Feathers, Flying, Wildlife",https://cdn.pixabay.com/photo/2012/02/29/12/04/swan-18829__340.jpg,"Swan, Bird, Feathers, Flying"
"Daisy, Daisies, Flower, Flowers",https://cdn.pixabay.com/photo/2012/03/17/22/29/daisy-22887__340.jpg,"Daisy, Daisies, Flower, Flowers"
"Bouquet, Floral, Flowers, Fresh, Garden",https://cdn.pixabay.com/photo/2012/02/22/09/19/bouquet-15308__340.jpg,"Bouquet, Floral, Flowers, Fresh"
"Sparrow, Tree, Branch, Bird",https://cdn.pixabay.com/photo/2011/09/27/18/52/sparrow-9950__340.jpg,"Sparrow, Tree, Branch, Bird"
"Flowers, Background, Butterflies",https://cdn.pixabay.com/photo/2012/03/01/00/55/flowers-19830__340.jpg,"Flowers, Background, Butterflies"
"Creek, Falls, Flow, Flowing, Forest",https://cdn.pixabay.com/photo/2012/03/04/00/05/creek-21749__340.jpg,"Creek, Falls, Flow, Flowing, Forest"
"Flower, Bouquet, Leaf, Nature, Green",https://cdn.pixabay.com/photo/2012/03/12/17/45/flower-22674__340.jpg,"Flower, Bouquet, Leaf, Nature"
"Rose, Blossom, Bloom, Red Rose",https://cdn.pixabay.com/photo/2011/05/31/19/44/rose-7634__340.jpg,"Rose, Blossom, Bloom, Red Rose"
"Color, Cute, Face, Female, Girl, Happy",https://cdn.pixabay.com/photo/2012/03/01/15/40/color-20412__340.jpg,"Color, Cute, Face, Female, Girl"
"Spider, Creepy, Scary, Arachnid, Fear",https://cdn.pixabay.com/photo/2017/09/12/01/25/spider-2740997__340.jpg,"Spider, Creepy, Scary, Arachnid"
"Gorilla, Monkey, Funny, Animal, Zoo",https://cdn.pixabay.com/photo/2017/08/28/22/59/gorilla-2691602__340.jpg,"Gorilla, Monkey, Funny, Animal, Zoo"
"Golden Rod, Gold Diamond",https://cdn.pixabay.com/photo/2017/08/20/20/52/golden-rod-2663113__340.jpg,"Golden Rod, Gold Diamond"
"Agaric, Lamellar, Milchling, Mushroom",https://cdn.pixabay.com/photo/2017/08/13/21/54/agaric-2638701__340.jpg,"Agaric, Lamellar, Milchling"
"Woman, Girl, Bike, Sunset, Walk",https://cdn.pixabay.com/photo/2017/09/03/17/26/woman-2711279__340.jpg,"Woman, Girl, Bike, Sunset, Walk"
"Cross, Christ, Faith, God, Jesus, Clouds",https://cdn.pixabay.com/photo/2017/09/04/09/38/cross-2713356__340.jpg,"Cross, Christ, Faith, God, Jesus"
"Duck, Mallard, Meadow, Rest, Drake",https://cdn.pixabay.com/photo/2017/06/13/19/26/duck-2399770__340.jpg,"Duck, Mallard, Meadow, Rest, Drake"
"People, Man, Woman, Holding Hands",https://cdn.pixabay.com/photo/2017/07/31/21/04/people-2561053__340.jpg,"People, Man, Woman, Holding Hands"
"Roll, Breakfast Sandwiches, Water Rolls",https://cdn.pixabay.com/photo/2017/07/23/18/23/roll-2532192__340.jpg,"Roll, Breakfast Sandwiches"
"Fly, Macro, Insect, Bug, Close",https://cdn.pixabay.com/photo/2017/07/20/21/49/fly-2523917__340.jpg,"Fly, Macro, Insect, Bug, Close"
"Hands, Open, Candle, Candlelight, Light",https://cdn.pixabay.com/photo/2016/12/22/22/07/hands-1926414__340.jpg,"Hands, Open, Candle, Candlelight"
"Analytics, Computer, Hiring, Database",https://cdn.pixabay.com/photo/2017/08/30/17/26/analytics-2697949__340.jpg,"Analytics, Computer, Hiring"
"Car Dashboard, Speedometer, Speed, Car",https://cdn.pixabay.com/photo/2017/08/22/00/27/car-dashboard-2667434__340.jpg,"Car Dashboard, Speedometer, Speed"
"Robbe, Seal, Howler, Aquatic Animal",https://cdn.pixabay.com/photo/2017/02/09/18/40/robbe-2053165__340.jpg,"Robbe, Seal, Howler, Aquatic Animal"
"Children, Child, People, Portrait",https://cdn.pixabay.com/photo/2015/06/22/08/37/children-817365__340.jpg,"Children, Child, People, Portrait"
"Spring Bird, Bird, Spring, Robin",https://cdn.pixabay.com/photo/2017/05/08/13/15/spring-bird-2295436__340.jpg,"Spring Bird, Bird, Spring, Robin"
"Castelmezzano, Italy, Village, Town",https://cdn.pixabay.com/photo/2017/01/14/13/59/castelmezzano-1979546__340.jpg,"Castelmezzano, Italy, Village, Town"
"Apple, Tree, Orchard, Red, Green, Ladder",https://cdn.pixabay.com/photo/2016/11/30/15/23/apple-1873078__340.jpg,"Apple, Tree, Orchard, Red, Green"
Round Leaved Bellflower,https://cdn.pixabay.com/photo/2016/08/07/11/30/round-leaved-bellflower-1576086__340.jpg,Round Leaved Bellflower
"Yoga, Fitness, Exercise, Health, Body",https://cdn.pixabay.com/photo/2018/01/01/01/56/yoga-3053487__340.jpg,"Yoga, Fitness, Exercise, Health"
"Wine, Glass, Alcohol, Glass Of Wine",https://cdn.pixabay.com/photo/2017/10/26/17/53/wine-2891894__340.jpg,"Wine, Glass, Alcohol, Glass Of Wine"
"Mehndi Designs, Henna, Bride, Design",https://cdn.pixabay.com/photo/2016/10/16/12/28/mehndi-designs-1745048__340.jpg,"Mehndi Designs, Henna, Bride"
"Cat, Cat'S Eyes, Eye, Animal, Pet",https://cdn.pixabay.com/photo/2017/03/14/14/49/cat-2143332__340.jpg,"Cat, Cat'S Eyes, Eye, Animal, Pet"
"Singapore, Skyscrapers, City",https://cdn.pixabay.com/photo/2017/01/18/21/49/singapore-1990959__340.jpg,"Singapore, Skyscrapers, City"
"Pov, Hand, Lens, Canon, 50Mm, Mirror",https://cdn.pixabay.com/photo/2017/12/28/22/03/pov-3046269__340.jpg,"Pov, Hand, Lens, Canon, 50Mm"
"Leaves, Autumn, Fall, Colors",https://cdn.pixabay.com/photo/2017/10/03/13/19/leaves-2812461__340.jpg,"Leaves, Autumn, Fall, Colors"
"People, Portrait, Man, Men, Male, Black",https://cdn.pixabay.com/photo/2017/06/26/02/47/people-2442565__340.jpg,"People, Portrait, Man, Men, Male"
"Oilseed Rape, Field Of Rapeseeds, Sunset",https://cdn.pixabay.com/photo/2017/03/11/13/19/oilseed-rape-2135026__340.jpg,"Oilseed Rape, Field Of Rapeseeds"
"Blue, Lake, Lake Constance, Nature",https://cdn.pixabay.com/photo/2017/08/31/20/14/blue-2702172__340.jpg,"Blue, Lake, Lake Constance, Nature"
"Drip, Water, Drop Of Water",https://cdn.pixabay.com/photo/2017/04/16/19/26/drip-2235632__340.jpg,"Drip, Water, Drop Of Water"
"Vegetables Landscape, Garden, Vegetables",https://cdn.pixabay.com/photo/2017/11/12/19/17/vegetables-landscape-2943500__340.jpg,"Vegetables Landscape, Garden"
"Apple, Red, Red Apple, Delicious, Fruit",https://cdn.pixabay.com/photo/2017/11/06/18/39/apple-2924531__340.jpg,"Apple, Red, Red Apple, Delicious"
"Banana Tree, Garden, Leaf",https://cdn.pixabay.com/photo/2012/06/15/17/44/banana-tree-50020__340.jpg,"Banana Tree, Garden, Leaf"
"Admission, Coupon, Admit, Buy, Carnival",https://cdn.pixabay.com/photo/2017/11/24/10/43/admission-2974645__340.jpg,"Admission, Coupon, Admit, Buy"
"Drip, Wet, Drop Of Water, Rain, Water",https://cdn.pixabay.com/photo/2017/10/01/16/22/drip-2806027__340.jpg,"Drip, Wet, Drop Of Water, Rain"
"Blue, Glasses, Pool, Detail, Vista, Look",https://cdn.pixabay.com/photo/2017/09/01/21/53/blue-2705642__340.jpg,"Blue, Glasses, Pool, Detail, Vista"
"Seemed, Pavement, Streetscape, Traffic",https://cdn.pixabay.com/photo/2017/10/06/17/46/seemed-2823949__340.jpg,"Seemed, Pavement, Streetscape"
"Christmas, Tree, Ornament, Deco, Light",https://cdn.pixabay.com/photo/2017/12/16/22/08/christmas-3023415__340.jpg,"Christmas, Tree, Ornament, Deco"
"Desktop Background, Love, In Love",https://cdn.pixabay.com/photo/2018/01/04/19/43/desktop-background-3061483__340.jpg,"Desktop Background, Love, In Love"
"People, Portrait, Adult, Man",https://cdn.pixabay.com/photo/2018/01/04/08/04/people-3060107__340.jpg,"People, Portrait, Adult, Man"
"Earth, Map, Winter, January, Continents",https://cdn.pixabay.com/photo/2011/12/13/17/07/earth-11047__340.jpg,"Earth, Map, Winter, January"
"Nature, Dandelion, Macro, Close, Flower",https://cdn.pixabay.com/photo/2018/01/19/14/40/nature-3092555__340.jpg,"Nature, Dandelion, Macro, Close"
"Box, Card, Celebrate, Celebration",https://cdn.pixabay.com/photo/2017/11/16/08/35/box-2953722__340.jpg,"Box, Card, Celebrate, Celebration"
"Christmas, Gifts, Gift Bag, Bag, Red",https://cdn.pixabay.com/photo/2017/11/14/00/57/christmas-2947257__340.jpg,"Christmas, Gifts, Gift Bag, Bag"
"Water, Water Splashes, High Speed",https://cdn.pixabay.com/photo/2017/11/12/19/22/high-speed-2943518__340.jpg,"Water, Water Splashes, High Speed"
"Face, Close-Up, Eyes, Lips, Smile, Hair",https://cdn.pixabay.com/photo/2017/11/10/12/53/face-2936245__340.jpg,"Face, Close-Up, Eyes, Lips, Smile"
"Beautiful, Bloom, Blossom, Pink, Flora",https://cdn.pixabay.com/photo/2010/12/13/10/21/beautiful-2703__340.jpg,"Beautiful, Bloom, Blossom, Pink"
"Pigeons, Couple, Pair, Twosome, Birds",https://cdn.pixabay.com/photo/2012/06/14/23/14/pigeons-50005__340.jpg,"Pigeons, Couple, Pair, Twosome"
"Africa, Animal, Brown, Cute, Big, Eyes",https://cdn.pixabay.com/photo/2012/03/02/11/06/africa-21115__340.jpg,"Africa, Animal, Brown, Cute, Big"
"Lupinien, Nature, New Zealand, Plant",https://cdn.pixabay.com/photo/2012/06/09/14/03/lupinien-49884__340.jpg,"Lupinien, Nature, New Zealand"
"Windräder, Wind Power, Energy, Blue",https://cdn.pixabay.com/photo/2017/12/01/20/28/windrader-2991696__340.jpg,"Windräder, Wind Power, Energy, Blue"
"Mammal, Nature, Animal World, Animal",https://cdn.pixabay.com/photo/2017/12/17/15/58/mammal-3024471__340.jpg,"Mammal, Nature, Animal World"
"Christmas, Lights, Balls, Lighting",https://cdn.pixabay.com/photo/2017/12/17/10/31/christmas-3023998__340.jpg,"Christmas, Lights, Balls, Lighting"
"Tulip, Spring, Nature, Flower, Color",https://cdn.pixabay.com/photo/2017/12/17/19/00/tulip-3024741__340.png,"Tulip, Spring, Nature, Flower"
"Fire, Flame, Carbon, Burn, Hot, Mood",https://cdn.pixabay.com/photo/2017/09/22/23/57/fire-2777580__340.jpg,"Fire, Flame, Carbon, Burn, Hot"
"Inflorescence, Flower Basket",https://cdn.pixabay.com/photo/2011/08/17/19/43/inflorescence-8878__340.jpg,"Inflorescence, Flower Basket"
"Nature, Outdoors, Infant, Family, Birth",https://cdn.pixabay.com/photo/2018/01/04/12/45/nature-3060601__340.jpg,"Nature, Outdoors, Infant, Family"
"Couple, Romance, Love, Kiss, Lovers",https://cdn.pixabay.com/photo/2018/01/05/22/48/couple-3064048__340.jpg,"Couple, Romance, Love, Kiss, Lovers"
"Coffee Tin, Coffee, Coffee Beans, Cafe",https://cdn.pixabay.com/photo/2016/09/30/11/13/coffee-tin-1705026__340.jpg,"Coffee Tin, Coffee, Coffee Beans"
"Antelope Canyon, Page, Sand Stone, Gorge",https://cdn.pixabay.com/photo/2010/12/23/12/43/antelope-canyon-4025__340.jpg,"Antelope Canyon, Page, Sand Stone"
"Tulips, Tulip, Field, Fields, Orange",https://cdn.pixabay.com/photo/2012/03/03/23/57/tulips-21690__340.jpg,"Tulips, Tulip, Field, Fields"
"Stone, Glass, Colorful, Gem, Color, Blue",https://cdn.pixabay.com/photo/2011/04/13/09/44/stone-6580__340.jpg,"Stone, Glass, Colorful, Gem, Color"
"Time, Clock, Background, Wrist Watch",https://cdn.pixabay.com/photo/2018/01/18/19/06/time-3091031__340.jpg,"Time, Clock, Background"
"Girl, Woman, Joy Of Life, Jump, Free",https://cdn.pixabay.com/photo/2017/11/11/21/55/girl-2940655__340.jpg,"Girl, Woman, Joy Of Life, Jump"
"Fantasy, Landscape, Mountains, Human",https://cdn.pixabay.com/photo/2017/11/07/00/07/fantasy-2925250__340.jpg,"Fantasy, Landscape, Mountains"
"Earth, Soil Creep, Moon, Lunar Surface",https://cdn.pixabay.com/photo/2011/12/13/14/30/earth-11014__340.jpg,"Earth, Soil Creep, Moon"
"Pamukkale, Lime Sinter Terrace, Calcium",https://cdn.pixabay.com/photo/2012/02/19/16/10/pamukkale-14979__340.jpg,"Pamukkale, Lime Sinter Terrace"
"Helicopter, Army, Military, War, Fight",https://cdn.pixabay.com/photo/2010/12/06/22/helicopter-1003__340.jpg,"Helicopter, Army, Military, War"
"Rainforest, New Zealand, South Island",https://cdn.pixabay.com/photo/2012/06/09/13/59/rainforest-49878__340.jpg,"Rainforest, New Zealand"
"Sky, Clouds, Outdoors, Scenic, Tranquil",https://cdn.pixabay.com/photo/2012/06/08/06/19/sky-49520__340.jpg,"Sky, Clouds, Outdoors, Scenic"
"Blossom, Bloom, White, Flower",https://cdn.pixabay.com/photo/2012/06/08/09/46/flower-49545__340.jpg,"Blossom, Bloom, White, Flower"
"Girl, Hands, Portrait, Woman, Beauty",https://cdn.pixabay.com/photo/2017/12/22/14/42/girl-3033718__340.jpg,"Girl, Hands, Portrait, Woman"
"The Sea, The Waterfall, Ocean Waves",https://cdn.pixabay.com/photo/2017/12/18/01/41/the-sea-3025268__340.jpg,"The Sea, The Waterfall, Ocean Waves"
"Schilthorn, Mountain Station",https://cdn.pixabay.com/photo/2017/12/22/11/09/schilthorn-3033448__340.jpg,"Schilthorn, Mountain Station"
"Away, Bridge, Web, Wood, Nature, Railing",https://cdn.pixabay.com/photo/2017/12/17/19/08/away-3024773__340.jpg,"Away, Bridge, Web, Wood, Nature"
"Model, Nude, Woman, Sexy, Naked, Fitness",https://cdn.pixabay.com/photo/2017/12/18/14/07/model-3026201__340.jpg,"Model, Nude, Woman, Sexy, Naked"
"Waffle Heart, Waffles, Icing Sugar",https://cdn.pixabay.com/photo/2017/08/30/17/12/waffle-heart-2697904__340.jpg,"Waffle Heart, Waffles, Icing Sugar"
"Cello, Strings, Stringed Instrument",https://cdn.pixabay.com/photo/2017/10/08/17/22/cello-2830670__340.jpg,"Cello, Strings, Stringed Instrument"
"Fly Agaric, Mushroom",https://cdn.pixabay.com/photo/2017/10/04/21/36/fly-agaric-2817723__340.jpg,"Fly Agaric, Mushroom"
"Chestnut, Buckeye, Ordinary Rosskastanie",https://cdn.pixabay.com/photo/2017/09/11/22/55/chestnut-2740751__340.jpg,"Chestnut, Buckeye"
"Chess, Black White, Chess Pieces, King",https://cdn.pixabay.com/photo/2017/09/08/20/29/chess-2730034__340.jpg,"Chess, Black White, Chess Pieces"
"Space Shuttle, Start, Discovery",https://cdn.pixabay.com/photo/2011/12/14/12/14/space-shuttle-11089__340.jpg,"Space Shuttle, Start, Discovery"
"Sheep, Agriculture, Animals, Countryside",https://cdn.pixabay.com/photo/2012/02/27/17/01/sheep-17482__340.jpg,"Sheep, Agriculture, Animals"
"Fly, Cap, Colorful, Danger, Fall, Forest",https://cdn.pixabay.com/photo/2012/03/03/23/56/fly-21685__340.jpg,"Fly, Cap, Colorful, Danger, Fall"
"Oregon, Grape, Holly, Purple, Berries",https://cdn.pixabay.com/photo/2012/04/07/22/39/oregon-26053__340.jpg,"Oregon, Grape, Holly, Purple"
"Human, Girl, Child, Face, Fee, Magic",https://cdn.pixabay.com/photo/2018/01/02/17/52/human-3056693__340.jpg,"Human, Girl, Child, Face, Fee"
"Person, Pear, Light Bulb, Sun",https://cdn.pixabay.com/photo/2018/01/05/07/16/person-3062271__340.jpg,"Person, Pear, Light Bulb, Sun"
"Hot Air Balloon, Lake, Balloon, Sunset",https://cdn.pixabay.com/photo/2017/06/17/10/55/hot-air-balloon-2411851__340.jpg,"Hot Air Balloon, Lake, Balloon"
"Persian Oak Wood, Parrotia Persica",https://cdn.pixabay.com/photo/2018/01/06/01/01/persian-oak-wood-3064187__340.jpg,"Persian Oak Wood, Parrotia Persica"
"Salt, Hon Khoi, Vietnam, Field",https://cdn.pixabay.com/photo/2018/01/04/07/59/salt-3060093__340.jpg,"Salt, Hon Khoi, Vietnam, Field"
"Rose, Flower, Petal, Floral, Love, Noble",https://cdn.pixabay.com/photo/2018/01/05/16/24/rose-3063284__340.jpg,"Rose, Flower, Petal, Floral, Love"
"Ballerina, Ballet Dancer, Dancer, Grazie",https://cdn.pixabay.com/photo/2018/01/01/23/38/ballerina-3055155__340.jpg,"Ballerina, Ballet Dancer, Dancer"
"Nude, Woman, Silhouette, Sexy, Erotic",https://cdn.pixabay.com/photo/2017/12/31/13/13/nude-3052317__340.jpg,"Nude, Woman, Silhouette, Sexy"
"Vegetables, Still Life, Forget, Vintage",https://cdn.pixabay.com/photo/2017/11/06/17/04/vegetables-2924239__340.jpg,"Vegetables, Still Life, Forget"
"Maritime, Hotel, Building, Facade",https://cdn.pixabay.com/photo/2011/04/13/02/07/maritime-6475__340.jpg,"Maritime, Hotel, Building, Facade"
"Windows, Reflection, Glass, Building",https://cdn.pixabay.com/photo/2012/02/19/10/49/windows-14874__340.jpg,"Windows, Reflection, Glass"
"Man, Red Hair, Beard, Red Beard, Redhead",https://cdn.pixabay.com/photo/2016/11/16/10/28/man-1828542__340.jpg,"Man, Red Hair, Beard, Red Beard"
"Rail, Girl, Composing, Fantasy",https://cdn.pixabay.com/photo/2017/09/30/22/16/rail-2803725__340.jpg,"Rail, Girl, Composing, Fantasy"
"Man, Portrait, Male Person, Human, Face",https://cdn.pixabay.com/photo/2017/09/25/13/12/man-2785071__340.jpg,"Man, Portrait, Male Person, Human"
"Black Swan, Red Beak, Red Eyes, Portrait",https://cdn.pixabay.com/photo/2017/10/02/02/30/black-swan-2807716__340.jpg,"Black Swan, Red Beak, Red Eyes"
"Banana, Fruit, Manipulation, Studio",https://cdn.pixabay.com/photo/2017/03/28/09/43/banana-2181470__340.jpg,"Banana, Fruit, Manipulation, Studio"
"Butterfly, Common Blue, Common Bläuling",https://cdn.pixabay.com/photo/2017/09/09/20/12/butterfly-2733287__340.jpg,"Butterfly, Common Blue"
"Axe, Wood, Hack, Cases, Wood Chop",https://cdn.pixabay.com/photo/2016/10/17/18/06/axe-1748305__340.jpg,"Axe, Wood, Hack, Cases, Wood Chop"
"Lake, Sunset, Bavaria, Abendstimmung",https://cdn.pixabay.com/photo/2017/09/18/22/20/lake-2763432__340.jpg,"Lake, Sunset, Bavaria"
"Cow, Allgäu, Cows, Cute, Ruminant",https://cdn.pixabay.com/photo/2017/09/26/14/48/cow-2788835__340.jpg,"Cow, Allgäu, Cows, Cute, Ruminant"
"Dyke Road, Hamburg, Port, Homes",https://cdn.pixabay.com/photo/2012/04/25/11/24/dyke-road-41832__340.jpg,"Dyke Road, Hamburg, Port, Homes"
"Blur, Blurred, Cascade, Fall, Flow",https://cdn.pixabay.com/photo/2012/03/03/23/52/blur-21653__340.jpg,"Blur, Blurred, Cascade, Fall, Flow"
"Leaf, Green, Macro, Structure, Texture",https://cdn.pixabay.com/photo/2010/12/13/09/57/leaf-1992__340.jpg,"Leaf, Green, Macro, Structure"
"Blossom, Bloom, Flower, Flora, Color",https://cdn.pixabay.com/photo/2012/05/06/00/55/flower-47447__340.jpg,"Blossom, Bloom, Flower, Flora"
"Orchid, Flower, Blossom, Bloom, White",https://cdn.pixabay.com/photo/2011/02/06/21/57/orchid-4780__340.jpg,"Orchid, Flower, Blossom, Bloom"
"Orchid, Flower, Flora, Florist, Plant",https://cdn.pixabay.com/photo/2012/03/04/00/57/orchid-22159__340.jpg,"Orchid, Flower, Flora, Florist"
"Sun, Grass, Dune, Denmark, Sky, North",https://cdn.pixabay.com/photo/2012/06/08/09/17/sun-49521__340.jpg,"Sun, Grass, Dune, Denmark, Sky"
"Sunset, Wadden Sea, North Sea, Mainland",https://cdn.pixabay.com/photo/2012/06/08/13/54/sunset-49564__340.jpg,"Sunset, Wadden Sea, North Sea"
"Fishing Boat, Denmark, Beach, Sea",https://cdn.pixabay.com/photo/2012/06/08/09/24/fishing-boat-49523__340.jpg,"Fishing Boat, Denmark, Beach, Sea"
"Sea Holly Flower, Eryngium, Plant",https://cdn.pixabay.com/photo/2012/02/17/14/53/sea-holly-flower-14129__340.jpg,"Sea Holly Flower, Eryngium, Plant"
"Swan, Proud To Be A Swan, Pride",https://cdn.pixabay.com/photo/2017/12/19/20/34/swan-3028659__340.jpg,"Swan, Proud To Be A Swan, Pride"
"Craftsman, Painting, The Knife, Lao Cai",https://cdn.pixabay.com/photo/2017/12/09/15/19/craftsman-3008031__340.jpg,"Craftsman, Painting, The Knife"
"Football, Shoe, Football Boot, Sport",https://cdn.pixabay.com/photo/2017/12/17/12/45/football-3024154__340.jpg,"Football, Shoe, Football Boot"
"Jogging, Run, Sport, Jog, Sporty, Race",https://cdn.pixabay.com/photo/2017/05/25/15/08/jogging-2343558__340.jpg,"Jogging, Run, Sport, Jog, Sporty"
"Sculpture, Wood, Child, Parents",https://cdn.pixabay.com/photo/2017/06/15/17/22/sculpture-2406078__340.jpg,"Sculpture, Wood, Child, Parents"
