keywords,link,title
"Paperclip, Clip, Office",https://cdn.pixabay.com/photo/2013/07/28/12/23/paperclip-168336__340.jpg,"Paperclip, Clip, Office"
"Thyme, Blossom, Bloom, Violet",https://cdn.pixabay.com/photo/2013/07/26/05/52/thyme-167468__340.jpg,"Thyme, Blossom, Bloom, Violet"
"Couple, Love, Tenderness, Sweethearts",https://cdn.pixabay.com/photo/2013/07/27/13/56/couple-168191__340.jpg,"Couple, Love, Tenderness"
"Rose, Flower, Red, Plant",https://cdn.pixabay.com/photo/2013/07/28/17/59/rose-168457__340.jpg,"Rose, Flower, Red, Plant"
"Stamen, Saffron, Orange, Violet, Flower",https://cdn.pixabay.com/photo/2013/07/08/02/00/stamen-143946__340.jpg,"Stamen, Saffron, Orange, Violet"
"Match, Matches, Sticks, Lighter, Wood",https://cdn.pixabay.com/photo/2013/07/04/15/26/match-143179__340.jpg,"Match, Matches, Sticks, Lighter"
"Hippopotamus, Hippo, Paarhufer, Mammal",https://cdn.pixabay.com/photo/2013/03/07/14/41/hippopotamus-91182__340.jpg,"Hippopotamus, Hippo, Paarhufer"
"Calculator, Solar Calculator, Count",https://cdn.pixabay.com/photo/2013/07/28/14/07/calculator-168360__340.jpg,"Calculator, Solar Calculator, Count"
"Goose, Animal, Bird, Nature, Meadow",https://cdn.pixabay.com/photo/2013/07/29/11/01/goose-168560__340.jpg,"Goose, Animal, Bird, Nature, Meadow"
"Ovary, Stamen, Stamens, Anther, Pollen",https://cdn.pixabay.com/photo/2013/07/26/02/35/ovary-167291__340.jpg,"Ovary, Stamen, Stamens, Anther"
"Colle-Di-Fuori, France, Town, Village",https://cdn.pixabay.com/photo/2013/07/30/01/12/colle-di-fuori-168766__340.jpg,"Colle-Di-Fuori, France, Town"
"Head, Portrait, Melancholic, Monument",https://cdn.pixabay.com/photo/2013/07/29/20/07/head-168707__340.jpg,"Head, Portrait, Melancholic"
"Oldtimer, Car, Old, Vintage, Headlight",https://cdn.pixabay.com/photo/2013/07/27/05/10/oldtimer-168127__340.jpg,"Oldtimer, Car, Old, Vintage"
"Göreme, Turkey, Cappadocia, Uchisar",https://cdn.pixabay.com/photo/2012/11/07/00/44/goreme-64873__340.jpg,"Göreme, Turkey, Cappadocia, Uchisar"
"Jellyfish, Luminous Jellyfish, Light",https://cdn.pixabay.com/photo/2013/05/24/17/23/jellyfish-113386__340.jpg,"Jellyfish, Luminous Jellyfish"
"Pair, Lovers, Togetherness, Together",https://cdn.pixabay.com/photo/2013/07/26/02/06/pair-167267__340.jpg,"Pair, Lovers, Togetherness"
"White, Flower, Plant, Flowers, Nature",https://cdn.pixabay.com/photo/2013/07/26/17/27/white-167895__340.jpg,"White, Flower, Plant, Flowers"
"Key, Metal, Home, Security, Wedding",https://cdn.pixabay.com/photo/2013/03/23/22/58/key-96233__340.jpg,"Key, Metal, Home, Security, Wedding"
"Eschscholzia Californica, Poppy, Blossom",https://cdn.pixabay.com/photo/2013/07/26/02/12/eschscholzia-californica-167272__340.jpg,"Eschscholzia Californica, Poppy"
"Stones, Rocks, Pebbles, Tranquil, Zen",https://cdn.pixabay.com/photo/2013/07/25/13/01/stones-167089__340.jpg,"Stones, Rocks, Pebbles, Tranquil"
"Dandelion, Flower, Flowers, Nature",https://cdn.pixabay.com/photo/2013/07/25/16/21/dandelion-167112__340.jpg,"Dandelion, Flower, Flowers, Nature"
"Cat, Cat Face, Sleep, Exhausted",https://cdn.pixabay.com/photo/2016/07/29/09/37/cat-1551783__340.jpg,"Cat, Cat Face, Sleep, Exhausted"
"Chestnut, Buckeye, Fruits, Red, Shiny",https://cdn.pixabay.com/photo/2016/10/02/20/58/chestnut-1710430__340.jpg,"Chestnut, Buckeye, Fruits, Red"
"Girl, Computer, Notebook",https://cdn.pixabay.com/photo/2015/11/26/22/27/girl-1064659__340.jpg,"Girl, Computer, Notebook"
"Meadow, Web, Sunset",https://cdn.pixabay.com/photo/2016/09/21/11/05/meadow-1684549__340.jpg,"Meadow, Web, Sunset"
"Owl, Bird, Animal, Nature, Portrait",https://cdn.pixabay.com/photo/2016/09/30/11/54/owl-1705112__340.jpg,"Owl, Bird, Animal, Nature, Portrait"
"Acorns, Tree Fruit, Fruits, Brown, Shiny",https://cdn.pixabay.com/photo/2016/10/02/22/16/acorns-1710577__340.jpg,"Acorns, Tree Fruit, Fruits, Brown"
"Isolated, Christmas Sack, Celebrate",https://cdn.pixabay.com/photo/2015/09/29/18/59/isolated-964342__340.png,"Isolated, Christmas Sack, Celebrate"
"Lifts, Architecture, Ludwig Erhard Haus",https://cdn.pixabay.com/photo/2016/08/13/12/11/lifts-1590608__340.jpg,"Lifts, Architecture"
"Old Woman, Portrait, Vietnam",https://cdn.pixabay.com/photo/2016/07/20/10/48/vietnam-1530123__340.jpg,"Old Woman, Portrait, Vietnam"
"New York, Woman, Fall, Taxi, Fantasy",https://cdn.pixabay.com/photo/2016/05/17/22/35/new-york-1399404__340.jpg,"New York, Woman, Fall, Taxi"
"Mountains, Lake, Bergsee, Haus Am See",https://cdn.pixabay.com/photo/2016/09/04/20/09/mountains-1645078__340.jpg,"Mountains, Lake, Bergsee"
"Beach, Sunset, Sand, Ocean, Beach Sunset",https://cdn.pixabay.com/photo/2016/06/06/20/06/beach-1440272__340.jpg,"Beach, Sunset, Sand, Ocean"
"Beauty, Flowers, Garden Flowers, Nature",https://cdn.pixabay.com/photo/2016/06/29/00/00/beauty-1485711__340.jpg,"Beauty, Flowers, Garden Flowers"
"Moon, Blue, Sky, Universe, Celestial",https://cdn.pixabay.com/photo/2016/07/19/04/40/moon-1527501__340.jpg,"Moon, Blue, Sky, Universe"
"Cherry, Cherries, Fruit",https://cdn.pixabay.com/photo/2016/07/22/02/58/cherry-1534063__340.jpg,"Cherry, Cherries, Fruit"
"Finger, Hand, Characters, Symbol",https://cdn.pixabay.com/photo/2016/09/26/23/28/finger-1697331__340.jpg,"Finger, Hand, Characters, Symbol"
"Stained Glass, Colorful, Glass",https://cdn.pixabay.com/photo/2016/08/12/20/43/stained-glass-1589648__340.jpg,"Stained Glass, Colorful, Glass"
"Wedding Dresses, Castle, Bride",https://cdn.pixabay.com/photo/2016/06/29/04/39/wedding-dresses-1486004__340.jpg,"Wedding Dresses, Castle, Bride"
"Figures, Heart, Funny, Winter, Christmas",https://cdn.pixabay.com/photo/2016/09/24/00/22/figures-1690796__340.jpg,"Figures, Heart, Funny, Winter"
"Mountain, Peak, Mountain Range",https://cdn.pixabay.com/photo/2016/06/17/04/26/mountain-1462655__340.jpg,"Mountain, Peak, Mountain Range"
"Woman, Face, Curly, Hair, Fashion, Girl",https://cdn.pixabay.com/photo/2016/06/06/17/05/model-1439909__340.jpg,"Woman, Face, Curly, Hair, Fashion"
"Horse, Gallop, Horses, Standard, Equine",https://cdn.pixabay.com/photo/2016/05/18/23/39/horse-1401914__340.jpg,"Horse, Gallop, Horses, Standard"
"Girl, Grass, Sunset, Light, Nature",https://cdn.pixabay.com/photo/2016/07/27/17/56/girl-1545885__340.jpg,"Girl, Grass, Sunset, Light, Nature"
"Winter, Snowy, Firs, Christmas, Cold",https://cdn.pixabay.com/photo/2016/09/16/21/40/winter-1675197__340.jpg,"Winter, Snowy, Firs, Christmas"
"Volkswagen, Auto, Historically, Vw",https://cdn.pixabay.com/photo/2016/07/11/14/30/volkswagen-1509784__340.jpg,"Volkswagen, Auto, Historically, Vw"
"Mouse, Rodent, Cute, Mammal, Nager",https://cdn.pixabay.com/photo/2016/10/01/20/54/mouse-1708347__340.jpg,"Mouse, Rodent, Cute, Mammal, Nager"
"Plant, Nature, Live",https://cdn.pixabay.com/photo/2016/06/24/13/07/cosmea-1477223__340.jpg,"Plant, Nature, Live"
"Faucet, Fountain, Water Dispenser",https://cdn.pixabay.com/photo/2016/09/21/14/46/faucet-1684902__340.jpg,"Faucet, Fountain, Water Dispenser"
"Animal, Nature, Live",https://cdn.pixabay.com/photo/2016/08/03/13/48/goslings-1566724__340.jpg,"Animal, Nature, Live"
"Mineral Water, Lime, Ice, Mint, Glass",https://cdn.pixabay.com/photo/2016/07/21/11/17/mineral-water-1532300__340.jpg,"Mineral Water, Lime, Ice, Mint"
"Hearts, Background, Red, Pink, White",https://cdn.pixabay.com/photo/2015/09/13/03/41/hearts-937664__340.jpg,"Hearts, Background, Red, Pink"
"Olympic Stadium, Berlin, 1936",https://cdn.pixabay.com/photo/2016/08/13/11/57/olympia-1590576__340.jpg,"Olympic Stadium, Berlin, 1936"
"Football, American Football, Game, Texas",https://cdn.pixabay.com/photo/2016/06/30/01/37/football-1488156__340.jpg,"Football, American Football, Game"
"Chimpanzee, Monkey, Ape, View",https://cdn.pixabay.com/photo/2016/07/27/10/49/chimpanzee-1545010__340.jpg,"Chimpanzee, Monkey, Ape, View"
"Mushrooms, Tomatoes, Greens, Nutrition",https://cdn.pixabay.com/photo/2016/04/25/10/19/mushrooms-1351561__340.jpg,"Mushrooms, Tomatoes, Greens"
"Shoes, Hiking Shoes, Hiking, Old, Worn",https://cdn.pixabay.com/photo/2016/09/02/11/10/shoes-1638873__340.jpg,"Shoes, Hiking Shoes, Hiking, Old"
"People, Portrait, Man, Male, Smile",https://cdn.pixabay.com/photo/2016/09/24/03/20/passion-1690965__340.jpg,"People, Portrait, Man, Male, Smile"
"Flintlock Pistol, Spyglass, Compass",https://cdn.pixabay.com/photo/2016/05/26/18/49/flintlock-pistol-1418080__340.jpg,"Flintlock Pistol, Spyglass, Compass"
"Golden Sunset, Clouds, Sky, Sunrays",https://cdn.pixabay.com/photo/2013/08/18/04/18/golden-sunset-173594__340.jpg,"Golden Sunset, Clouds, Sky, Sunrays"
"Horse, White, Horsehair, Equine",https://cdn.pixabay.com/photo/2016/07/26/10/30/horse-1542480__340.jpg,"Horse, White, Horsehair, Equine"
"Pink Hair, Hairstyle, Women, Young Women",https://cdn.pixabay.com/photo/2016/06/11/12/13/hair-1450045__340.jpg,"Pink Hair, Hairstyle, Women"
"Hand, Baby Cardinal, Cardinal, Bird, Fly",https://cdn.pixabay.com/photo/2013/08/18/04/03/hand-173584__340.jpg,"Hand, Baby Cardinal, Cardinal, Bird"
"Fingers, Immensity, Hand, Horizon, Sky",https://cdn.pixabay.com/photo/2013/08/12/20/26/fingers-171977__340.jpg,"Fingers, Immensity, Hand, Horizon"
"Parachutes, Sky, Clouds, Parachutists",https://cdn.pixabay.com/photo/2013/02/24/04/03/parachutes-85606__340.jpg,"Parachutes, Sky, Clouds"
"Rose Hip, Fruit, Sammelfrucht, Red",https://cdn.pixabay.com/photo/2011/11/16/15/41/rose-hip-10496__340.jpg,"Rose Hip, Fruit, Sammelfrucht, Red"
"Chough, Bird, Black, Bill",https://cdn.pixabay.com/photo/2010/12/28/00/41/chough-4208__340.jpg,"Chough, Bird, Black, Bill"
"Sunlight, Forest, Way, Path, Evening",https://cdn.pixabay.com/photo/2013/07/25/01/31/sunlight-166733__340.jpg,"Sunlight, Forest, Way, Path"
"Parachute, Paratrooper, Parachutist",https://cdn.pixabay.com/photo/2012/10/26/01/43/parachute-63045__340.jpg,"Parachute, Paratrooper, Parachutist"
"Cake, Wine, Dessert, Fruit, Sweet",https://cdn.pixabay.com/photo/2013/08/23/16/21/cake-175049__340.jpg,"Cake, Wine, Dessert, Fruit, Sweet"
"Tulips, Flowers, Red, Purple, Yellow",https://cdn.pixabay.com/photo/2013/08/25/11/12/tulips-175605__340.jpg,"Tulips, Flowers, Red, Purple"
"Drop Of Water, Drop, Splash, Water",https://cdn.pixabay.com/photo/2013/07/25/01/31/drop-of-water-166735__340.jpg,"Drop Of Water, Drop, Splash, Water"
"Filter, Espresso, Espresso Machine",https://cdn.pixabay.com/photo/2013/08/24/19/03/filter-175301__340.jpg,"Filter, Espresso, Espresso Machine"
"Flower, Pink Flower, Flowers, Nature",https://cdn.pixabay.com/photo/2013/08/11/19/37/flower-171644__340.jpg,"Flower, Pink Flower, Flowers"
"Spider, Black Widow, Red, Black, Creepy",https://cdn.pixabay.com/photo/2013/08/25/10/52/spider-175582__340.jpg,"Spider, Black Widow, Red, Black"
"Snake, Zoo, Macro, Animal, Enlarge View",https://cdn.pixabay.com/photo/2013/08/11/19/47/snake-171655__340.jpg,"Snake, Zoo, Macro, Animal"
"Abstract, Architecture, Background, Blue",https://cdn.pixabay.com/photo/2012/03/04/00/21/abstract-21890__340.jpg,"Abstract, Architecture, Background"
"Orange Juice, Juice, Vitamins, Drink",https://cdn.pixabay.com/photo/2012/11/28/09/31/orange-juice-67556__340.jpg,"Orange Juice, Juice, Vitamins"
"Cactus Dahlia, Dahlia, Blossom, Bloom",https://cdn.pixabay.com/photo/2013/07/26/18/04/cactus-dahlia-167955__340.jpg,"Cactus Dahlia, Dahlia, Blossom"
"Ocean, Waves, Tide, Stones, Beach, Water",https://cdn.pixabay.com/photo/2013/07/27/05/13/ocean-168133__340.jpg,"Ocean, Waves, Tide, Stones, Beach"
"Reno Airshow, Airplanes, Air Show",https://cdn.pixabay.com/photo/2013/08/25/03/44/reno-airshow-175521__340.jpg,"Reno Airshow, Airplanes, Air Show"
"Lavender, Lavender Flowers, Bee",https://cdn.pixabay.com/photo/2013/07/26/16/23/lavender-167789__340.jpg,"Lavender, Lavender Flowers, Bee"
"Swan, Animal, Water Bird, Duck Bird",https://cdn.pixabay.com/photo/2013/08/26/02/11/swan-175898__340.jpg,"Swan, Animal, Water Bird, Duck Bird"
"Field, Away, Summer, Sky, Clouds, Lane",https://cdn.pixabay.com/photo/2013/08/26/09/24/field-175959__340.jpg,"Field, Away, Summer, Sky, Clouds"
"Hirsch, Animal, Male, Animal World",https://cdn.pixabay.com/photo/2013/08/16/14/20/hirsch-173131__340.jpg,"Hirsch, Animal, Male, Animal World"
"Dog, Animal, Friend, Loyalty, Sweetheart",https://cdn.pixabay.com/photo/2012/12/24/08/40/dog-72333__340.jpg,"Dog, Animal, Friend, Loyalty"
"Afterglow, Sunset, Evening Sky",https://cdn.pixabay.com/photo/2012/12/30/22/20/afterglow-73147__340.jpg,"Afterglow, Sunset, Evening Sky"
"Fire, Flame, Burn, Chair, Wood Fire",https://cdn.pixabay.com/photo/2013/08/26/09/39/fire-175966__340.jpg,"Fire, Flame, Burn, Chair, Wood Fire"
"Sphaerocephalon, Leek Flower, Blossom",https://cdn.pixabay.com/photo/2013/07/26/17/16/sphaerocephalon-167878__340.jpg,"Sphaerocephalon, Leek Flower"
"Trees, Pine, Needles, Pine Cones, Branch",https://cdn.pixabay.com/photo/2013/08/25/23/15/trees-175864__340.jpg,"Trees, Pine, Needles, Pine Cones"
"Sunrise, Bayer Forest, Danube Valley",https://cdn.pixabay.com/photo/2013/08/26/09/40/sunrise-175971__340.jpg,"Sunrise, Bayer Forest"
"Lions, Animal, Male, Female Lions",https://cdn.pixabay.com/photo/2013/08/26/04/44/lions-175934__340.jpg,"Lions, Animal, Male, Female Lions"
"Tulips, Tulip Bed, Flowers, North Park",https://cdn.pixabay.com/photo/2013/08/24/13/33/tulips-175254__340.jpg,"Tulips, Tulip Bed, Flowers"
"Pods, Lime Blossom, Linde, Winter Linde",https://cdn.pixabay.com/photo/2012/09/03/19/32/pods-55862__340.jpg,"Pods, Lime Blossom, Linde"
"Brown, Modern Building, Office, City",https://cdn.pixabay.com/photo/2012/12/11/21/28/brown-69488__340.jpg,"Brown, Modern Building, Office"
"Bee, Insect, Purple, Flower, Wasp",https://cdn.pixabay.com/photo/2013/08/17/04/21/bee-173322__340.jpg,"Bee, Insect, Purple, Flower, Wasp"
"Lotus, Lotus Seed Head, Leaves",https://cdn.pixabay.com/photo/2013/08/16/17/08/lotus-173187__340.jpg,"Lotus, Lotus Seed Head, Leaves"
"Roe Deer, Nature, Wild, Forest, Scheu",https://cdn.pixabay.com/photo/2013/08/16/14/20/roe-deer-173132__340.jpg,"Roe Deer, Nature, Wild, Forest"
"Candles, Lights Serenade, Lights, River",https://cdn.pixabay.com/photo/2013/07/26/18/53/candles-168015__340.jpg,"Candles, Lights Serenade, Lights"
"Sunset, Beach Surf, Water, Sea, Surf",https://cdn.pixabay.com/photo/2013/08/11/05/08/sunset-171466__340.jpg,"Sunset, Beach Surf, Water, Sea"
"Flamingo, Animal, Flamingos",https://cdn.pixabay.com/photo/2013/08/16/14/20/flamingo-173127__340.jpg,"Flamingo, Animal, Flamingos"
"Berlin, The Reichstag, People",https://cdn.pixabay.com/photo/2016/08/04/21/31/berlin-1571046__340.jpg,"Berlin, The Reichstag, People"
"Lion, Lion Cub, Cat, Big Cat, Animal",https://cdn.pixabay.com/photo/2016/07/27/10/41/lion-1544990__340.jpg,"Lion, Lion Cub, Cat, Big Cat"
"Sea Star, Beach, Marine Fauna",https://cdn.pixabay.com/photo/2016/07/07/01/00/sea-star-1501698__340.jpg,"Sea Star, Beach, Marine Fauna"
"Italy, Cala Gonone, Air, Sky, Clouds",https://cdn.pixabay.com/photo/2016/08/23/16/34/italy-1614931__340.jpg,"Italy, Cala Gonone, Air, Sky"
"Candy, Food, Sweet, Unhealthy, Eating",https://cdn.pixabay.com/photo/2016/09/18/20/25/candy-1678933__340.jpg,"Candy, Food, Sweet, Unhealthy"
"Reflection, Photo, Photograph, Camera",https://cdn.pixabay.com/photo/2016/06/16/13/06/reflection-1461298__340.jpg,"Reflection, Photo, Photograph"
"Girl, Out, Nature, Autumn, Face",https://cdn.pixabay.com/photo/2016/06/30/09/44/girl-1488663__340.jpg,"Girl, Out, Nature, Autumn, Face"
"Elephant, Safari, Animal, Defence, Color",https://cdn.pixabay.com/photo/2016/05/28/08/32/elephant-1421167__340.jpg,"Elephant, Safari, Animal, Defence"
"Leaf, Web, Black White, Yellow Sheet",https://cdn.pixabay.com/photo/2016/08/05/09/21/leaf-1571833__340.jpg,"Leaf, Web, Black White"
"Girl, Lavender, Flowers, Mov, Beauty",https://cdn.pixabay.com/photo/2016/06/21/23/06/girl-1472191__340.jpg,"Girl, Lavender, Flowers, Mov"
"Money, Dollars, Success, Business",https://cdn.pixabay.com/photo/2016/06/01/08/40/money-1428594__340.jpg,"Money, Dollars, Success, Business"
"Kiwi, Fruit, Green, The Richness Of",https://cdn.pixabay.com/photo/2016/06/02/20/58/kiwi-1432088__340.jpg,"Kiwi, Fruit, Green, The Richness Of"
"American Football, Football Team",https://cdn.pixabay.com/photo/2016/06/16/03/02/american-football-1460541__340.jpg,"American Football, Football Team"
"Stock Rose, Baby Rose, Flower, Blossom",https://cdn.pixabay.com/photo/2016/07/18/01/52/stock-rose-1525145__340.jpg,"Stock Rose, Baby Rose, Flower"
"Lavender, Lavender Field",https://cdn.pixabay.com/photo/2016/08/15/14/18/lavender-1595490__340.jpg,"Lavender, Lavender Field"
"Cereal, Spoon, Milk, Cheerios, Children",https://cdn.pixabay.com/photo/2016/06/08/19/46/cereal-1444495__340.jpg,"Cereal, Spoon, Milk, Cheerios"
"Detail, Evening Light, Sunset, Light",https://cdn.pixabay.com/photo/2016/06/03/21/47/detail-1434536__340.jpg,"Detail, Evening Light, Sunset"
"Girl, Roses, Red, Wreath, Flowers",https://cdn.pixabay.com/photo/2016/05/19/17/08/girl-1403417__340.jpg,"Girl, Roses, Red, Wreath, Flowers"
"Tree, Sky, Against Light, Sunshine",https://cdn.pixabay.com/photo/2016/06/23/20/23/tree-1476127__340.jpg,"Tree, Sky, Against Light, Sunshine"
"Drinking Water, Mess, Glacier, Cast Iron",https://cdn.pixabay.com/photo/2016/06/01/15/45/advertising-1429216__340.jpg,"Drinking Water, Mess, Glacier"
"Grapes, Fruit, Fruits, Blue, Winegrowing",https://cdn.pixabay.com/photo/2016/09/26/20/10/grapes-1696921__340.jpg,"Grapes, Fruit, Fruits, Blue"
"Ulm, Münster, Bridge, Church Ulm, Tower",https://cdn.pixabay.com/photo/2016/09/23/17/05/ulm-1690078__340.jpg,"Ulm, Münster, Bridge, Church Ulm"
"Portrait, Photo, Photography, Picture",https://cdn.pixabay.com/photo/2016/06/21/15/50/photo-1471331__340.jpg,"Portrait, Photo, Photography"
"Render, Graphic, Architecture, 3D",https://cdn.pixabay.com/photo/2016/06/24/10/47/render-1477041__340.jpg,"Render, Graphic, Architecture, 3D"
"Computer Room, Room, Computer, Work",https://cdn.pixabay.com/photo/2016/06/30/05/05/computer-room-1488311__340.jpg,"Computer Room, Room, Computer, Work"
"Chile, Patagonia, Flock, Nature, Glacier",https://cdn.pixabay.com/photo/2016/06/17/18/45/chile-1463830__340.jpg,"Chile, Patagonia, Flock, Nature"
"Girl, Young, Woman, Beauty, Model, Hair",https://cdn.pixabay.com/photo/2015/11/26/22/28/girl-1064664__340.jpg,"Girl, Young, Woman, Beauty, Model"
"Lavender Field, Flowers, Purple, Flora",https://cdn.pixabay.com/photo/2016/08/15/14/36/lavender-field-1595587__340.jpg,"Lavender Field, Flowers, Purple"
"Schutzengelchen, Angel, Figure, Cute",https://cdn.pixabay.com/photo/2016/09/23/22/45/schutzengelchen-1690635__340.jpg,"Schutzengelchen, Angel, Figure"
"Crocodile, Tooth, Reptile, Alligator",https://cdn.pixabay.com/photo/2016/09/11/01/41/crocodile-1660537__340.jpg,"Crocodile, Tooth, Reptile"
"Corn On The Cob, Corn, Food, Field",https://cdn.pixabay.com/photo/2016/09/23/20/36/corn-on-the-cob-1690387__340.jpg,"Corn On The Cob, Corn, Food, Field"
"Sunglasses, For Women, Fashion, Summer",https://cdn.pixabay.com/photo/2013/09/01/17/54/sunglasses-178154__340.jpg,"Sunglasses, For Women, Fashion"
"Teddy, Plush, Bears, Cute, Teddy Bear",https://cdn.pixabay.com/photo/2016/08/26/23/46/teddy-1623436__340.jpg,"Teddy, Plush, Bears, Cute"
"Olive, Oil, Food, Power Supply",https://cdn.pixabay.com/photo/2016/03/17/02/22/olive-1262184__340.jpg,"Olive, Oil, Food, Power Supply"
"Tee, Herbs, Mix, Medicinal Herbs, Aroma",https://cdn.pixabay.com/photo/2016/09/19/18/01/tee-1680885__340.jpg,"Tee, Herbs, Mix, Medicinal Herbs"
"Kids, Children, Boys, Friendship, Africa",https://cdn.pixabay.com/photo/2014/10/05/07/10/kids-474729__340.jpg,"Kids, Children, Boys, Friendship"
"Sheltie, Bitch, Lying, Sunset, Moss",https://cdn.pixabay.com/photo/2016/01/22/13/13/sheltie-1155731__340.jpg,"Sheltie, Bitch, Lying, Sunset, Moss"
"Boots, Travel, Track, Architecture, Shoe",https://cdn.pixabay.com/photo/2013/09/12/19/57/boots-181744__340.jpg,"Boots, Travel, Track, Architecture"
"Dragonfly, Red, Animal, Insect",https://cdn.pixabay.com/photo/2013/08/30/11/54/dragonfly-177338__340.jpg,"Dragonfly, Red, Animal, Insect"
"Ifa, F9, Oldtimer, Pkw, Ddr",https://cdn.pixabay.com/photo/2016/09/12/18/56/ifa-1665443__340.jpg,"Ifa, F9, Oldtimer, Pkw, Ddr"
"Paperclip, Clip, Office",https://cdn.pixabay.com/photo/2013/09/01/17/07/paperclip-178126__340.jpg,"Paperclip, Clip, Office"
"Colors, Glass, Sugar",https://cdn.pixabay.com/photo/2013/09/02/19/35/colors-178351__340.jpg,"Colors, Glass, Sugar"
"Tulips, Purple, Flower, Perennial",https://cdn.pixabay.com/photo/2013/08/31/18/13/tulips-177889__340.jpg,"Tulips, Purple, Flower, Perennial"
"Calculator, Paperclip, Pen, Office",https://cdn.pixabay.com/photo/2013/09/01/17/07/calculator-178127__340.jpg,"Calculator, Paperclip, Pen, Office"
"Goose, Water Bird, Nature, Bird, River",https://cdn.pixabay.com/photo/2013/09/01/17/35/goose-178143__340.jpg,"Goose, Water Bird, Nature, Bird"
"Sunglasses, Men'S, Orange, Summer",https://cdn.pixabay.com/photo/2013/09/01/17/54/sunglasses-178151__340.jpg,"Sunglasses, Men'S, Orange, Summer"
"Girl, Young, Woman, Beauty, Model, Hair",https://cdn.pixabay.com/photo/2015/11/26/22/28/girl-1064667__340.jpg,"Girl, Young, Woman, Beauty, Model"
"Bar-Tailed Godwit, Godwit, Bar-Tailed",https://cdn.pixabay.com/photo/2015/09/18/00/13/bar-tailed-godwit-944883__340.jpg,"Bar-Tailed Godwit, Godwit"
"Blue, Pflanzenrest, Isolated, Frame",https://cdn.pixabay.com/photo/2013/04/28/14/22/blue-107705__340.jpg,"Blue, Pflanzenrest, Isolated, Frame"
"Colored Pencils, Pens, Crayons",https://cdn.pixabay.com/photo/2013/07/28/14/40/colored-pencils-168392__340.jpg,"Colored Pencils, Pens, Crayons"
"Matchstick, Fire, Light, Striking",https://cdn.pixabay.com/photo/2012/03/01/01/34/matchstick-20237__340.jpg,"Matchstick, Fire, Light, Striking"
"Butterfly, Blue, Insect",https://cdn.pixabay.com/photo/2013/06/30/18/56/butterfly-142506__340.jpg,"Butterfly, Blue, Insect"
"Green Monkeys, Monkey, Old World Monkey",https://cdn.pixabay.com/photo/2013/05/20/10/51/green-monkeys-112275__340.jpg,"Green Monkeys, Monkey"
"Sunset, Sunrise, Sunlight, Outdoor, Dawn",https://cdn.pixabay.com/photo/2013/08/29/02/48/sunset-176939__340.jpg,"Sunset, Sunrise, Sunlight, Outdoor"
"Germany, Building, Stone, Window",https://cdn.pixabay.com/photo/2013/08/28/00/50/germany-176595__340.jpg,"Germany, Building, Stone, Window"
"Green Leaf, Natural, Wallpaper",https://cdn.pixabay.com/photo/2013/08/28/11/47/green-leaf-176722__340.jpg,"Green Leaf, Natural, Wallpaper"
"Tee, Glass, Tea Infuser, Tea Mix",https://cdn.pixabay.com/photo/2016/09/21/22/00/tee-1685847__340.jpg,"Tee, Glass, Tea Infuser, Tea Mix"
"Hawaii, Wind Surfing, Recreation, Sports",https://cdn.pixabay.com/photo/2013/09/11/00/28/hawaii-181082__340.jpg,"Hawaii, Wind Surfing, Recreation"
"Night, Light, Sea, Boats, Island, Islets",https://cdn.pixabay.com/photo/2013/08/27/02/01/night-176084__340.jpg,"Night, Light, Sea, Boats, Island"
"Butterfly, Wings, Red, Flowers",https://cdn.pixabay.com/photo/2013/08/27/12/59/butterfly-176156__340.jpg,"Butterfly, Wings, Red, Flowers"
"Reno Airshow, Airplanes, Air Show",https://cdn.pixabay.com/photo/2013/08/25/03/44/reno-airshow-175520__340.jpg,"Reno Airshow, Airplanes, Air Show"
"Match, Lighter, Matches, Sticks",https://cdn.pixabay.com/photo/2013/08/11/14/52/match-171579__340.jpg,"Match, Lighter, Matches, Sticks"
"St Mary'S Cathedral, Fürstenwalde",https://cdn.pixabay.com/photo/2013/09/10/05/58/st-marys-cathedral-180865__340.jpg,"St Mary'S Cathedral, Fürstenwalde"
"Flower, Plant, Blossom, Nature, Lilac",https://cdn.pixabay.com/photo/2013/08/28/18/06/flower-176816__340.jpg,"Flower, Plant, Blossom, Nature"
"Beach, Lagoon, Sunset, Sundown",https://cdn.pixabay.com/photo/2013/07/18/15/01/beach-164288__340.jpg,"Beach, Lagoon, Sunset, Sundown"
"Sunset, Poppy, Backlight",https://cdn.pixabay.com/photo/2013/08/20/15/47/sunset-174276__340.jpg,"Sunset, Poppy, Backlight"
"Sky, Forward, Clouds, Sunset",https://cdn.pixabay.com/photo/2013/08/27/22/58/sky-176523__340.jpg,"Sky, Forward, Clouds, Sunset"
"Landscape, Meadow, Field, Mountains",https://cdn.pixabay.com/photo/2013/08/28/00/54/landscape-176602__340.jpg,"Landscape, Meadow, Field, Mountains"
"Plumage, Feather, Bird, Pink, Violet",https://cdn.pixabay.com/photo/2013/08/28/12/03/plumage-176723__340.jpg,"Plumage, Feather, Bird, Pink"
"Wine Glasses, Stemware, Crystal",https://cdn.pixabay.com/photo/2013/08/29/04/41/wine-glasses-176991__340.jpg,"Wine Glasses, Stemware, Crystal"
"Butterfly, Exotic, South America, Amazon",https://cdn.pixabay.com/photo/2013/08/27/09/01/butterfly-176133__340.jpg,"Butterfly, Exotic, South America"
"Sky, Forward, Clouds, Sunset",https://cdn.pixabay.com/photo/2013/08/27/22/54/sky-176490__340.jpg,"Sky, Forward, Clouds, Sunset"
"Forest, Tree, Bach, Water Running, Wave",https://cdn.pixabay.com/photo/2013/05/13/06/18/forest-110900__340.jpg,"Forest, Tree, Bach, Water Running"
"Flower, Macro, Nature, Bud",https://cdn.pixabay.com/photo/2013/09/07/18/00/flower-180035__340.jpg,"Flower, Macro, Nature, Bud"
"Fireworks, Light, Japan, Festival, Sky",https://cdn.pixabay.com/photo/2013/09/08/19/54/fireworks-180553__340.jpg,"Fireworks, Light, Japan, Festival"
"Sunrise, Ocean, Sea, Water, Sunset",https://cdn.pixabay.com/photo/2013/08/17/14/32/sunrise-173392__340.jpg,"Sunrise, Ocean, Sea, Water, Sunset"
"Water, Color, Liquid, Pink, Mood, Drip",https://cdn.pixabay.com/photo/2013/09/07/20/27/water-180116__340.jpg,"Water, Color, Liquid, Pink, Mood"
"Africa, African, Animal, Big, Brown",https://cdn.pixabay.com/photo/2013/07/19/00/18/africa-165200__340.jpg,"Africa, African, Animal, Big, Brown"
"Sunset, Japan, Sky, Sea, Water, Ship",https://cdn.pixabay.com/photo/2013/09/08/19/35/sunset-180544__340.jpg,"Sunset, Japan, Sky, Sea, Water"
"Rose, Pink, Red, Flower, Blossom, Bloom",https://cdn.pixabay.com/photo/2013/09/05/01/26/rose-179002__340.jpg,"Rose, Pink, Red, Flower, Blossom"
