keywords,link,title
"Flowers, Bridal Bouquet, Wedding",https://cdn.pixabay.com/photo/2014/02/07/11/35/flowers-260897__340.jpg,"Flowers, Bridal Bouquet, Wedding"
"Druse, Geode, Gem, Gemstone, Agate Stone",https://cdn.pixabay.com/photo/2014/03/09/21/43/druse-284144__340.jpg,"Druse, Geode, Gem, Gemstone"
"Flower Buds, Mahogany, Plant, Nature",https://cdn.pixabay.com/photo/2013/12/14/11/50/flower-buds-228592__340.jpg,"Flower Buds, Mahogany, Plant"
"Schnauzer, Miniature Schnauzer, Dog",https://cdn.pixabay.com/photo/2014/02/27/16/08/schnauzer-275936__340.jpg,"Schnauzer, Miniature Schnauzer, Dog"
"Crow, Corvus Frugilegus, Rook",https://cdn.pixabay.com/photo/2014/03/10/14/35/crow-284491__340.jpg,"Crow, Corvus Frugilegus, Rook"
"Cougar, Mountain Lion, Big Cat, Feline",https://cdn.pixabay.com/photo/2014/02/27/16/08/cougar-275946__340.jpg,"Cougar, Mountain Lion, Big Cat"
"Razor, Home Appliances, Small Appliances",https://cdn.pixabay.com/photo/2011/07/25/03/27/razor-8309__340.jpg,"Razor, Home Appliances"
"Amelanchier, Leaves, Autumn, Orange, Red",https://cdn.pixabay.com/photo/2013/12/14/00/59/amelanchier-228108__340.jpg,"Amelanchier, Leaves, Autumn, Orange"
"Breakwater, Poles, Beach, Wood, Anglesea",https://cdn.pixabay.com/photo/2014/02/19/03/04/breakwater-269649__340.jpg,"Breakwater, Poles, Beach, Wood"
"Bloom, Flower, Garden, Spring, Narcissus",https://cdn.pixabay.com/photo/2014/03/08/10/49/bloom-283020__340.jpg,"Bloom, Flower, Garden, Spring"
"Pallas Cat, Cat, Manul, Wild, Wild Cat",https://cdn.pixabay.com/photo/2014/02/27/16/08/pallas-cat-275930__340.jpg,"Pallas Cat, Cat, Manul, Wild"
"Leaves, Tree, Summer, Autumn, Branch",https://cdn.pixabay.com/photo/2016/02/11/10/54/leaves-1193378__340.jpg,"Leaves, Tree, Summer, Autumn"
"Xerochrysum Bracteatum, Strawflower",https://cdn.pixabay.com/photo/2014/02/23/15/17/xerochrysum-bracteatum-272992__340.jpg,"Xerochrysum Bracteatum, Strawflower"
"Singer, Mexicans, Sing, Man, Hat",https://cdn.pixabay.com/photo/2014/01/24/10/40/singer-250933__340.jpg,"Singer, Mexicans, Sing, Man, Hat"
"Apple Blossoms, Apple Blossom Branch",https://cdn.pixabay.com/photo/2012/09/03/17/26/apple-blossoms-55773__340.jpg,Apple Blossoms
"Flower, Summer, Spring, Gardening, Macro",https://cdn.pixabay.com/photo/2014/02/27/16/10/flower-276012__340.jpg,"Flower, Summer, Spring, Gardening"
"Queen Ant, Ant, Ant Head, Insect",https://cdn.pixabay.com/photo/2016/02/11/12/36/queen-ant-1193472__340.jpg,"Queen Ant, Ant, Ant Head, Insect"
"Girl, Smartphone, Apple, Takes A Picture",https://cdn.pixabay.com/photo/2016/02/10/16/39/girl-1192032__340.jpg,"Girl, Smartphone, Apple"
"Easter, Easter Eggs, Colorful",https://cdn.pixabay.com/photo/2016/03/05/12/08/easter-1237635__340.jpg,"Easter, Easter Eggs, Colorful"
"Rose, Rosaceae, Flower, Pink, Garden",https://cdn.pixabay.com/photo/2014/03/15/21/13/rose-288090__340.jpg,"Rose, Rosaceae, Flower, Pink"
"Dogs, Carnival, Humor, Pet, Ernst",https://cdn.pixabay.com/photo/2016/02/09/17/43/dogs-1190015__340.jpg,"Dogs, Carnival, Humor, Pet, Ernst"
"Water, Lemon, Drink, Refreshment, Glass",https://cdn.pixabay.com/photo/2016/02/08/20/45/water-1187656__340.jpg,"Water, Lemon, Drink, Refreshment"
"Kut Berry, Fruit, Health, Orange, Berry",https://cdn.pixabay.com/photo/2016/01/30/20/07/kut-berry-1170510__340.jpg,"Kut Berry, Fruit, Health, Orange"
"Owl, Little Owl, Bird, Animal, Wildlife",https://cdn.pixabay.com/photo/2014/02/27/16/08/owl-275941__340.jpg,"Owl, Little Owl, Bird, Animal"
"Water, Splash, Flow, Drop Of Water, Drop",https://cdn.pixabay.com/photo/2014/03/15/21/24/water-288104__340.jpg,"Water, Splash, Flow, Drop Of Water"
"Spring Flower, Tree, Nature, Pink",https://cdn.pixabay.com/photo/2014/03/18/11/24/spring-flower-289844__340.jpg,"Spring Flower, Tree, Nature, Pink"
"Passion Flower, Flower, Blossom, Bloom",https://cdn.pixabay.com/photo/2014/03/10/07/24/passion-flower-284291__340.jpg,"Passion Flower, Flower, Blossom"
"Lake, Evening, Sunset, Abendstimmung",https://cdn.pixabay.com/photo/2014/03/17/10/00/lake-289011__340.jpg,"Lake, Evening, Sunset"
"Guitar, Music, Rock, Musical Instrument",https://cdn.pixabay.com/photo/2016/02/05/11/18/guitar-1180744__340.jpg,"Guitar, Music, Rock"
"Fruit, Mandarins, Fresh, Healthy",https://cdn.pixabay.com/photo/2016/02/05/18/27/fruit-1181730__340.jpg,"Fruit, Mandarins, Fresh, Healthy"
"Senior Photography, Model, Portrait",https://cdn.pixabay.com/photo/2016/02/05/05/12/senior-photography-1180435__340.jpg,"Senior Photography, Model, Portrait"
"Sunflower, Nature, Flowers",https://cdn.pixabay.com/photo/2014/03/19/13/38/sunflower-290496__340.jpg,"Sunflower, Nature, Flowers"
"Splashing, Splash, Aqua, Water, Rain",https://cdn.pixabay.com/photo/2014/02/27/16/08/splashing-275950__340.jpg,"Splashing, Splash, Aqua, Water"
"Dog, Bernese Mountain Dog, Berner",https://cdn.pixabay.com/photo/2014/03/14/20/13/dog-287420__340.jpg,"Dog, Bernese Mountain Dog, Berner"
"China, Buddha Statues, Religion, God",https://cdn.pixabay.com/photo/2016/02/03/13/05/china-1177009__340.jpg,"China, Buddha Statues, Religion"
"Mittens, Gloves, Knitted, Pels, Blue Sky",https://cdn.pixabay.com/photo/2016/02/03/14/56/mittens-1177211__340.jpg,"Mittens, Gloves, Knitted, Pels"
"Zebra, Wildlife, Africa, Safari, Wild",https://cdn.pixabay.com/photo/2016/01/30/07/08/zebra-1169259__340.jpg,"Zebra, Wildlife, Africa, Safari"
"Elephant, Wild, Animal, Mud, Spray",https://cdn.pixabay.com/photo/2016/02/17/15/38/elephant-1205260__340.jpg,"Elephant, Wild, Animal, Mud, Spray"
"Hot Chocolate, Drink, Dairy, Winter",https://cdn.pixabay.com/photo/2015/11/23/11/57/hot-chocolate-1058197__340.jpg,"Hot Chocolate, Drink, Dairy, Winter"
"Crocus, Blossom, Bloom, Flower, Spring",https://cdn.pixabay.com/photo/2014/03/21/20/42/crocus-292306__340.jpg,"Crocus, Blossom, Bloom, Flower"
"Blossom, Bloom, Flower, White Green",https://cdn.pixabay.com/photo/2014/03/30/11/24/flower-301359__340.jpg,"Blossom, Bloom, Flower, White Green"
"Sea Lion, Head, Water, Wet, Animal World",https://cdn.pixabay.com/photo/2014/03/30/10/24/sea-lion-301283__340.jpg,"Sea Lion, Head, Water, Wet"
"Sunrise, Sky, Uluru, Beginning, Desert",https://cdn.pixabay.com/photo/2016/02/28/03/51/sunrise-1226471__340.jpg,"Sunrise, Sky, Uluru, Beginning"
"Drosera Capensis, Cape Sundew, Sundew",https://cdn.pixabay.com/photo/2016/01/30/17/50/drosera-capensis-1170128__340.jpg,"Drosera Capensis, Cape Sundew"
"Snow, Baby, Girl, White, Happy, Season",https://cdn.pixabay.com/photo/2016/02/23/08/43/snow-1217124__340.jpg,"Snow, Baby, Girl, White, Happy"
"Guitar, Country, Girl, Acoustic Guitar",https://cdn.pixabay.com/photo/2015/09/17/14/24/guitar-944261__340.jpg,"Guitar, Country, Girl"
"Ant, Macro, Animal, Insects, Small",https://cdn.pixabay.com/photo/2016/01/08/11/46/ant-1127650__340.jpg,"Ant, Macro, Animal, Insects, Small"
"Ice, Wire, Winter, Blue, Cold, Metal",https://cdn.pixabay.com/photo/2016/01/25/08/46/ice-1160261__340.jpg,"Ice, Wire, Winter, Blue, Cold"
"Banana Shrub, Banana, Food, Fruit, Green",https://cdn.pixabay.com/photo/2014/03/30/21/09/banana-shrub-301663__340.jpg,"Banana Shrub, Banana, Food, Fruit"
"Horse, Cowboy, West, Ride, Usa",https://cdn.pixabay.com/photo/2014/03/30/09/56/horse-301257__340.jpg,"Horse, Cowboy, West, Ride, Usa"
"Cat, Feline, Pet, Kitten, Domestic",https://cdn.pixabay.com/photo/2014/03/30/23/49/cat-301723__340.jpg,"Cat, Feline, Pet, Kitten, Domestic"
"Watch Tv, Camera, Interview, Tv, Human",https://cdn.pixabay.com/photo/2014/03/30/16/54/watch-tv-301528__340.jpg,"Watch Tv, Camera, Interview, Tv"
"Tussilago Farfara, Flower, Macro, Close",https://cdn.pixabay.com/photo/2014/03/30/22/32/tussilago-farfara-301704__340.jpg,"Tussilago Farfara, Flower, Macro"
"Boy, Hungry, Sad",https://cdn.pixabay.com/photo/2016/02/28/12/55/boy-1226964__340.jpg,"Boy, Hungry, Sad"
"Magnolia, Magnolia Blossom, Flowers",https://cdn.pixabay.com/photo/2014/04/14/20/38/magnolia-324216__340.jpg,"Magnolia, Magnolia Blossom, Flowers"
"City, Old, Architecture, Old Town",https://cdn.pixabay.com/photo/2016/01/11/18/20/city-1134141__340.jpg,"City, Old, Architecture, Old Town"
"Almond, Flower, Alentejo, Nature",https://cdn.pixabay.com/photo/2016/02/15/19/12/almond-1201795__340.jpg,"Almond, Flower, Alentejo, Nature"
"Pont Du Gard, France, Bridge, Aqaedukt",https://cdn.pixabay.com/photo/2012/09/12/13/55/pont-du-gard-56801__340.jpg,"Pont Du Gard, France, Bridge"
"Butterfly, White, Black, Nymph",https://cdn.pixabay.com/photo/2016/02/24/01/52/white-1218884__340.jpg,"Butterfly, White, Black, Nymph"
"Girl, Woman, Female, Sexy, Person, Model",https://cdn.pixabay.com/photo/2016/02/20/01/00/girl-1211436__340.jpg,"Girl, Woman, Female, Sexy, Person"
"Elephant, Africa, Namibia, Nature, Dry",https://cdn.pixabay.com/photo/2016/01/30/17/41/africa-1170108__340.jpg,"Elephant, Africa, Namibia, Nature"
"Apple Juice, Sweet, Fruit Juice, Healthy",https://cdn.pixabay.com/photo/2015/11/21/18/07/apple-juice-1055331__340.jpg,"Apple Juice, Sweet, Fruit Juice"
"Girl, Beauty, Portrait, Winter, Smile",https://cdn.pixabay.com/photo/2016/01/28/19/10/girl-1166842__340.jpg,"Girl, Beauty, Portrait, Winter"
"Orange, Slice, Dried Fruits, Oranges",https://cdn.pixabay.com/photo/2016/01/27/14/22/orange-1164504__340.jpg,"Orange, Slice, Dried Fruits"
"Food, Dessert, Cheesecakes, Breakfast",https://cdn.pixabay.com/photo/2016/01/22/02/05/food-1155129__340.jpg,"Food, Dessert, Cheesecakes"
"Man, Soledad, Only, Landscape, Summer",https://cdn.pixabay.com/photo/2016/01/22/20/14/man-1156543__340.jpg,"Man, Soledad, Only, Landscape"
"Admirable Grasshopper, Wildlife, Nature",https://cdn.pixabay.com/photo/2016/01/21/16/02/admirable-grasshopper-1154048__340.jpg,"Admirable Grasshopper, Wildlife"
"Pine, Needles, Flowers, Blossoms",https://cdn.pixabay.com/photo/2014/03/30/16/46/pine-301511__340.jpg,"Pine, Needles, Flowers, Blossoms"
"Railway, Black And White",https://cdn.pixabay.com/photo/2014/03/30/00/12/railway-301155__340.jpg,"Railway, Black And White"
"Rose, Flowers, Blossom, Bloom, Beauty",https://cdn.pixabay.com/photo/2014/03/30/13/01/rose-301406__340.jpg,"Rose, Flowers, Blossom, Bloom"
"Hot Chocolate, Snow, Christmas, Hot",https://cdn.pixabay.com/photo/2015/11/29/13/16/hot-chocolate-1068704__340.jpg,"Hot Chocolate, Snow, Christmas, Hot"
"Fallow Deer, Dama Dama, Male, Wild",https://cdn.pixabay.com/photo/2015/10/12/15/46/fallow-deer-984573__340.jpg,"Fallow Deer, Dama Dama, Male, Wild"
"Heart, Sky, Dahl, Blue Sky",https://cdn.pixabay.com/photo/2016/02/21/12/11/heart-1213481__340.jpg,"Heart, Sky, Dahl, Blue Sky"
"Background, Berries, Berry, Bitter",https://cdn.pixabay.com/photo/2016/03/05/23/02/background-1239435__340.jpg,"Background, Berries, Berry, Bitter"
"Beauty, Barbie, Pretty, Doll, Charming",https://cdn.pixabay.com/photo/2016/03/16/15/22/beauty-1260989__340.jpg,"Beauty, Barbie, Pretty, Doll"
"Sparrow, Sperling, Wet, Water, Bathing",https://cdn.pixabay.com/photo/2016/01/21/17/06/sparrow-1154182__340.jpg,"Sparrow, Sperling, Wet, Water"
"Damselfly, Odonata, Insect, Macro",https://cdn.pixabay.com/photo/2016/01/10/09/59/damselfly-1131638__340.jpg,"Damselfly, Odonata, Insect, Macro"
"Japanese Cherry Trees, Flowers, Pink",https://cdn.pixabay.com/photo/2014/04/14/20/20/japanese-cherry-trees-324187__340.jpg,"Japanese Cherry Trees, Flowers"
"Fruit, Vitamins, Health, Sweet, Bananas",https://cdn.pixabay.com/photo/2016/02/21/00/29/fruit-1213041__340.jpg,"Fruit, Vitamins, Health, Sweet"
"Strawberries, Chocolate, Food, Sweet",https://cdn.pixabay.com/photo/2016/02/25/22/58/strawberries-1223153__340.jpg,"Strawberries, Chocolate, Food"
"Africa, Namibia, Landscape, Dry, Heiss",https://cdn.pixabay.com/photo/2016/01/30/17/22/africa-1170055__340.jpg,"Africa, Namibia, Landscape, Dry"
"Frogs, Curious, Funny, Figures, Cute",https://cdn.pixabay.com/photo/2016/01/24/14/27/frogs-1158958__340.jpg,"Frogs, Curious, Funny, Figures"
"Vodka, Ad, Alcohol, Party, Cocktail",https://cdn.pixabay.com/photo/2015/09/13/04/06/vodka-937680__340.jpg,"Vodka, Ad, Alcohol, Party, Cocktail"
"Fog, Forest, Mist, Mysterious",https://cdn.pixabay.com/photo/2016/02/24/18/37/fog-1220491__340.jpg,"Fog, Forest, Mist, Mysterious"
"Common Hazel, Hazel, Aesthetic",https://cdn.pixabay.com/photo/2016/02/24/18/18/common-hazel-1220465__340.jpg,"Common Hazel, Hazel, Aesthetic"
"Red Rose, Rose, Rose Bloom, Blossom",https://cdn.pixabay.com/photo/2014/04/10/11/38/red-rose-320892__340.jpg,"Red Rose, Rose, Rose Bloom, Blossom"
"Climbing, Wood, Palgakjeong, Cloud",https://cdn.pixabay.com/photo/2016/01/19/14/25/octagonal-pavilion-1148883__340.jpg,"Climbing, Wood, Palgakjeong, Cloud"
"Underwater, Fish, Atlantis, Sea, Water",https://cdn.pixabay.com/photo/2016/02/22/18/46/underwater-1216244__340.jpg,"Underwater, Fish, Atlantis, Sea"
"Frogs, Athletes, Football, Tennis, Golf",https://cdn.pixabay.com/photo/2016/02/20/15/28/frogs-1212209__340.jpg,"Frogs, Athletes, Football, Tennis"
"Snowman, Winter, Town, Urban",https://cdn.pixabay.com/photo/2014/04/10/15/37/snowman-321034__340.jpg,"Snowman, Winter, Town, Urban"
"Paprika, Vegetables, Colorful, Food",https://cdn.pixabay.com/photo/2014/04/09/15/31/paprika-320138__340.jpg,"Paprika, Vegetables, Colorful, Food"
"Blossom, Bloom, Flower, White Green",https://cdn.pixabay.com/photo/2014/03/30/11/22/flower-301353__340.jpg,"Blossom, Bloom, Flower, White Green"
"Parrot, Colorful, Plumage, Portrait",https://cdn.pixabay.com/photo/2014/04/09/10/31/parrot-320006__340.jpg,"Parrot, Colorful, Plumage, Portrait"
"Tulip, Lily, Nature, Flowers, Tulips",https://cdn.pixabay.com/photo/2014/03/16/22/17/tulip-288906__340.jpg,"Tulip, Lily, Nature, Flowers"
"Baby, Girl, Sleep, Child, Toddler",https://cdn.pixabay.com/photo/2016/01/20/11/11/baby-1151351__340.jpg,"Baby, Girl, Sleep, Child, Toddler"
"Pecans, Nut, Walnuts",https://cdn.pixabay.com/photo/2016/02/22/03/54/pecans-1214713__340.jpg,"Pecans, Nut, Walnuts"
"The Lizard, Gad, Spring, Animal, Zoo",https://cdn.pixabay.com/photo/2016/02/19/11/42/the-lizard-1209887__340.jpg,"The Lizard, Gad, Spring, Animal"
"Sunrise, Cloudless, Ocean, Orange, Dawn",https://cdn.pixabay.com/photo/2014/04/09/12/09/sunrise-320079__340.jpg,"Sunrise, Cloudless, Ocean, Orange"
"Swan, Water Bird, Nature, Water",https://cdn.pixabay.com/photo/2014/04/08/17/41/swan-319379__340.jpg,"Swan, Water Bird, Nature, Water"
"Dandelion, Green, Orange, Nature, Flora",https://cdn.pixabay.com/photo/2014/04/09/09/56/dandelion-319939__340.jpg,"Dandelion, Green, Orange, Nature"
"Wild Orchid, Orchid, Blossom, Bloom",https://cdn.pixabay.com/photo/2014/04/09/05/57/wild-orchid-319787__340.jpg,"Wild Orchid, Orchid, Blossom, Bloom"
"Macro, Nature, Reflection, Beautiful",https://cdn.pixabay.com/photo/2014/04/08/13/40/macro-319237__340.jpg,"Macro, Nature, Reflection"
"Football, Football Boots, Shoe, Sports",https://cdn.pixabay.com/photo/2016/02/18/14/30/football-1207235__340.jpg,"Football, Football Boots, Shoe"
"Blossom, Bloom, Flower, Red Purple",https://cdn.pixabay.com/photo/2014/04/02/11/49/flower-305877__340.jpg,"Blossom, Bloom, Flower, Red Purple"
"Leaf, Leaves, Colorful, Green, Macro",https://cdn.pixabay.com/photo/2014/04/07/16/51/leaf-318743__340.jpg,"Leaf, Leaves, Colorful, Green"
"Matteucia Struthiopteris, Fern, Leaf",https://cdn.pixabay.com/photo/2016/02/17/16/09/matteucia-struthiopteris-1205292__340.jpg,"Matteucia Struthiopteris, Fern"
"Sunset, Novovoronezh, Summer",https://cdn.pixabay.com/photo/2014/03/16/12/51/sunset-288531__340.jpg,"Sunset, Novovoronezh, Summer"
"Children, Toys, Bicycle, Son",https://cdn.pixabay.com/photo/2016/02/23/10/42/children-1217246__340.jpg,"Children, Toys, Bicycle, Son"
"Crocus, Flower, Spring, Purple, Blossom",https://cdn.pixabay.com/photo/2014/03/05/18/18/crocus-280276__340.jpg,"Crocus, Flower, Spring, Purple"
"Hirsch, Red Deer, Animal, Antler, Graze",https://cdn.pixabay.com/photo/2012/10/01/15/30/hirsch-58655__340.jpg,"Hirsch, Red Deer, Animal, Antler"
"Flowers, Wedding, Getting Married",https://cdn.pixabay.com/photo/2016/02/11/16/10/flowers-1193840__340.jpg,"Flowers, Wedding, Getting Married"
"Cherry Blossom, Blossom, Bloom, Spring",https://cdn.pixabay.com/photo/2014/04/01/11/06/cherry-blossom-302434__340.jpg,"Cherry Blossom, Blossom, Bloom"
"Sunset, Sea, Landscape",https://cdn.pixabay.com/photo/2014/04/05/13/05/sunset-317042__340.jpg,"Sunset, Sea, Landscape"
"Chameleon, Lizard, Multi-Coloured",https://cdn.pixabay.com/photo/2014/04/07/14/25/chameleon-318649__340.jpg,"Chameleon, Lizard, Multi-Coloured"
"Dandelion, Plant, Close, Summer, Macro",https://cdn.pixabay.com/photo/2014/03/31/18/16/dandelion-302129__340.jpg,"Dandelion, Plant, Close, Summer"
"Record, Player, Disk, Turntable, Vinyl",https://cdn.pixabay.com/photo/2014/05/03/00/45/record-336626__340.jpg,"Record, Player, Disk, Turntable"
"Horse, Nature, Animals, Meadow",https://cdn.pixabay.com/photo/2014/05/03/19/37/horse-337215__340.jpg,"Horse, Nature, Animals, Meadow"
"New York City, Brooklyn Bridge, Night",https://cdn.pixabay.com/photo/2014/05/02/23/46/new-york-city-336475__340.jpg,"New York City, Brooklyn Bridge"
"Florence, Ponte Vecchio, Italy, Clouds",https://cdn.pixabay.com/photo/2014/05/02/19/44/florence-336264__340.jpg,"Florence, Ponte Vecchio, Italy"
"Children, Beach, Blond, Swim, Sky, Skin",https://cdn.pixabay.com/photo/2014/05/02/18/43/children-336225__340.jpg,"Children, Beach, Blond, Swim, Sky"
"Home Office, Workstation, Office",https://cdn.pixabay.com/photo/2014/05/02/21/49/home-office-336373__340.jpg,"Home Office, Workstation, Office"
"Evening Sky, Sky, Clouds, Light, Sunset",https://cdn.pixabay.com/photo/2014/05/02/12/43/evening-sky-335969__340.jpg,"Evening Sky, Sky, Clouds, Light"
"Swan, Water Bird, Water, River",https://cdn.pixabay.com/photo/2014/05/02/09/59/swan-335911__340.jpg,"Swan, Water Bird, Water, River"
"Wellness, Massage, Relax, Relaxing",https://cdn.pixabay.com/photo/2014/03/11/22/56/wellness-285587__340.jpg,"Wellness, Massage, Relax, Relaxing"
"Golden Pheasant, Pheasant, Bird",https://cdn.pixabay.com/photo/2014/04/29/21/35/golden-pheasant-334658__340.jpg,"Golden Pheasant, Pheasant, Bird"
"Vittorio Emanuele Monument, Rome",https://cdn.pixabay.com/photo/2014/03/26/05/47/vittorio-emanuele-monument-298412__340.jpg,"Vittorio Emanuele Monument, Rome"
"Common Dandelion, Dandelion",https://cdn.pixabay.com/photo/2014/05/01/17/51/common-dandelion-335662__340.jpg,"Common Dandelion, Dandelion"
"Dandelions, Dandelion, Medical, Green",https://cdn.pixabay.com/photo/2014/05/01/16/47/dandelions-335574__340.jpg,"Dandelions, Dandelion, Medical"
"Roller, Vespa, Motor Scooter, Vehicle",https://cdn.pixabay.com/photo/2014/04/30/10/28/roller-334802__340.jpg,"Roller, Vespa, Motor Scooter"
"Fir, Tannenzweig, Pine Cones, Needles",https://cdn.pixabay.com/photo/2014/04/28/19/24/fir-334011__340.jpg,"Fir, Tannenzweig, Pine Cones"
"Traffic, Highway, Lights, Night, Road",https://cdn.pixabay.com/photo/2014/04/27/00/43/traffic-332857__340.jpg,"Traffic, Highway, Lights, Night"
"Ukraine, Tank Cars, Railroad, Railway",https://cdn.pixabay.com/photo/2014/04/26/12/11/ukraine-332449__340.jpg,"Ukraine, Tank Cars, Railroad"
"Dandelion, Faded, Seeds, Multiplication",https://cdn.pixabay.com/photo/2014/04/25/18/55/dandelion-332073__340.jpg,"Dandelion, Faded, Seeds"
"Grey Crowned Crane, Crane",https://cdn.pixabay.com/photo/2014/04/25/17/44/grey-crowned-crane-331988__340.jpg,"Grey Crowned Crane, Crane"
"Yachts, Port, Marbella, Marina",https://cdn.pixabay.com/photo/2014/04/25/01/21/yachts-331744__340.jpg,"Yachts, Port, Marbella, Marina"
"Industry, Factory, Industrial Plant",https://cdn.pixabay.com/photo/2016/01/14/20/55/industry-1140760__340.jpg,"Industry, Factory, Industrial Plant"
"Match, Flame, Lighter, Matches, Sticks",https://cdn.pixabay.com/photo/2015/12/20/10/02/match-1100912__340.jpg,"Match, Flame, Lighter, Matches"
"Barn Owl, Bird, Owl, Nature, Wildlife",https://cdn.pixabay.com/photo/2015/12/25/06/32/barn-owl-1107397__340.jpg,"Barn Owl, Bird, Owl, Nature"
"Woman, Potrait, Outdoor, Female, Model",https://cdn.pixabay.com/photo/2016/01/08/21/15/woman-1129248__340.jpg,"Woman, Potrait, Outdoor, Female"
"Salmon, Fish, Run, Jump, Travel",https://cdn.pixabay.com/photo/2015/12/25/06/39/salmon-1107404__340.jpg,"Salmon, Fish, Run, Jump, Travel"
"Insect, Macro, Animal, Fly, Wildlife",https://cdn.pixabay.com/photo/2016/01/09/16/29/insect-1130497__340.jpg,"Insect, Macro, Animal, Fly"
"Child, Love, Potatos",https://cdn.pixabay.com/photo/2015/12/28/19/09/child-1111818__340.jpg,"Child, Love, Potatos"
"Sykora, Bird, Small, Curious, Background",https://cdn.pixabay.com/photo/2016/01/11/15/23/sykora-1133784__340.jpg,"Sykora, Bird, Small, Curious"
"Tangerines, Fruit, Citrus Fruit, Healthy",https://cdn.pixabay.com/photo/2015/12/28/15/25/tangerines-1111529__340.jpg,"Tangerines, Fruit, Citrus Fruit"
"Insect, Macro, Bug, Nature, Animal",https://cdn.pixabay.com/photo/2016/01/14/14/09/insect-1140026__340.jpg,"Insect, Macro, Bug, Nature, Animal"
"Indian, Boy, Team, Child, Male, Asian",https://cdn.pixabay.com/photo/2016/01/03/10/11/indian-1119255__340.jpg,"Indian, Boy, Team, Child, Male"
"Cat, Milk, Teacup, Persian, Language",https://cdn.pixabay.com/photo/2015/11/06/13/05/cat-1027486__340.jpg,"Cat, Milk, Teacup, Persian"
"Chess, Love, Story",https://cdn.pixabay.com/photo/2016/01/22/08/02/chess-1155418__340.jpg,"Chess, Love, Story"
"Wasp, Yellow, Insect, Macro, Nature",https://cdn.pixabay.com/photo/2016/01/05/13/12/bee-1122469__340.jpg,"Wasp, Yellow, Insect, Macro, Nature"
"Zebra, Wildlife, Africa, Animal",https://cdn.pixabay.com/photo/2016/01/15/08/54/zebra-1141302__340.jpg,"Zebra, Wildlife, Africa, Animal"
"Frogs, Pair, Love, Valentine'S Day, Pose",https://cdn.pixabay.com/photo/2015/08/23/18/55/frogs-903176__340.jpg,"Frogs, Pair, Love, Valentine'S Day"
"Gun, Home, House, Gunpoint, Person, Male",https://cdn.pixabay.com/photo/2015/09/13/04/08/gun-937682__340.jpg,"Gun, Home, House, Gunpoint, Person"
"Interior, Villa, Rendering",https://cdn.pixabay.com/photo/2015/11/06/11/45/interior-1026446__340.jpg,"Interior, Villa, Rendering"
"Dubai, Burj Khalifa, Skyscraper, Night",https://cdn.pixabay.com/photo/2015/12/09/17/09/dubai-1085058__340.jpg,"Dubai, Burj Khalifa, Skyscraper"
"Flowers, Spring, Tulips, Plant, Meadow",https://cdn.pixabay.com/photo/2015/11/02/14/57/flowers-1018499__340.jpg,"Flowers, Spring, Tulips, Plant"
"Indian, Boys, Team, Child, Male, Asian",https://cdn.pixabay.com/photo/2016/01/24/12/55/indian-1158807__340.jpg,"Indian, Boys, Team, Child, Male"
"Chile House, Hamburg, Historically",https://cdn.pixabay.com/photo/2015/12/31/11/52/chile-house-1115590__340.jpg,"Chile House, Hamburg, Historically"
"Lotus, Flower, Summer, Zen, Lake, Nature",https://cdn.pixabay.com/photo/2015/10/09/00/55/lotus-978659__340.jpg,"Lotus, Flower, Summer, Zen, Lake"
"Tea, Hot, Cup, Drink, Cup Of Tea",https://cdn.pixabay.com/photo/2015/12/13/04/23/tea-1090672__340.jpg,"Tea, Hot, Cup, Drink, Cup Of Tea"
"Mountain, Nature, Landscape",https://cdn.pixabay.com/photo/2015/10/12/11/27/mountain-983661__340.jpg,"Mountain, Nature, Landscape"
"Ski, Equipment, Skiing, Sport, Winter",https://cdn.pixabay.com/photo/2015/09/09/17/57/ski-932188__340.jpg,"Ski, Equipment, Skiing, Sport"
"Castle, Hohenzollern, Sunrise, Fortress",https://cdn.pixabay.com/photo/2015/10/05/19/12/castle-973157__340.jpg,"Castle, Hohenzollern, Sunrise"
"Bananas, Fruit, Yellow, Healthy",https://cdn.pixabay.com/photo/2016/01/03/17/59/bananas-1119790__340.jpg,"Bananas, Fruit, Yellow, Healthy"
"Magical, Childhood, Christmas, Fantasy",https://cdn.pixabay.com/photo/2015/12/13/04/11/magical-1090663__340.jpg,"Magical, Childhood, Christmas"
"Family, People, Car, Looking, Children",https://cdn.pixabay.com/photo/2015/09/09/18/06/family-932245__340.jpg,"Family, People, Car, Looking"
"White Oak Borer, Head, Insect, Eyes",https://cdn.pixabay.com/photo/2015/09/30/16/02/white-oak-borer-965683__340.jpg,"White Oak Borer, Head, Insect, Eyes"
"Macaw, Parrot, Bird, Hybrid, Red, Green",https://cdn.pixabay.com/photo/2015/09/16/19/51/macaw-943228__340.jpg,"Macaw, Parrot, Bird, Hybrid, Red"
"Water, Swimming Pool, Bathing, Travel",https://cdn.pixabay.com/photo/2015/11/02/18/32/water-1018808__340.jpg,"Water, Swimming Pool, Bathing"
"Skipper, Close Up, Macro, Butterfly",https://cdn.pixabay.com/photo/2015/12/14/01/15/skipper-1091953__340.jpg,"Skipper, Close Up, Macro, Butterfly"
"Tulips, Red, Flowers, Spring, Close",https://cdn.pixabay.com/photo/2016/01/02/02/53/tulips-1117859__340.jpg,"Tulips, Red, Flowers, Spring, Close"
"Frog, Photographer, Funny, Fun, Camera",https://cdn.pixabay.com/photo/2015/08/14/19/42/frog-888798__340.jpg,"Frog, Photographer, Funny, Fun"
"Bull, Farm, Cattle, Agriculture",https://cdn.pixabay.com/photo/2015/12/30/15/52/bull-1114267__340.jpg,"Bull, Farm, Cattle, Agriculture"
"Insect, Bug, Macro, Animal, Nature",https://cdn.pixabay.com/photo/2016/01/05/13/22/insect-1122495__340.jpg,"Insect, Bug, Macro, Animal, Nature"
"Grouse, Sunrise, Scotland, Birding",https://cdn.pixabay.com/photo/2015/12/25/06/42/grouse-1107407__340.jpg,"Grouse, Sunrise, Scotland, Birding"
"Minion, Funny, Toys, Children, Figure",https://cdn.pixabay.com/photo/2015/10/05/17/09/minion-972908__340.jpg,"Minion, Funny, Toys, Children"
"Bird, Birds, Ibis, Flight, Ala, Stork",https://cdn.pixabay.com/photo/2014/05/22/10/40/bird-350680__340.jpg,"Bird, Birds, Ibis, Flight, Ala"
"Drop Of Water, Drip, Blade Of Grass",https://cdn.pixabay.com/photo/2014/05/23/05/34/drop-of-water-351778__340.jpg,"Drop Of Water, Drip, Blade Of Grass"
"Starfish, Sand, Beach, Sea, Water, Sun",https://cdn.pixabay.com/photo/2014/05/14/00/49/starfish-343791__340.jpg,"Starfish, Sand, Beach, Sea, Water"
"Aircraft, Cargo Aircraft, Cargo",https://cdn.pixabay.com/photo/2012/10/25/23/41/aircraft-62880__340.jpg,"Aircraft, Cargo Aircraft, Cargo"
"Photo, Camera, Photography, Digital",https://cdn.pixabay.com/photo/2014/05/22/22/05/photo-351528__340.jpg,"Photo, Camera, Photography, Digital"
